"No.","Time","Source","Destination","Protocol","Length","Packet Type","Header Form","Connection Number","Stream index","Info"
"1","0.000000","24207","7443","TCP","56","","","","","24207  >  7443 [SYN] Seq=0 Win=65535 Len=0 MSS=65495 WS=256 SACK_PERM=1"
"2","0.000059","7443","24207","TCP","56","","","","","7443  >  24207 [SYN, ACK] Seq=0 Ack=1 Win=65535 Len=0 MSS=65495 WS=256 SACK_PERM=1"
"3","0.000088","24207","7443","TCP","44","","","","","24207  >  7443 [ACK] Seq=1 Ack=1 Win=2619648 Len=0"
"4","0.225582","24207","7443","TLSv1.3","561","","","","","Client Hello"
"5","0.225610","7443","24207","TCP","44","","","","","7443  >  24207 [ACK] Seq=1 Ack=518 Win=2619648 Len=0"
"6","0.226367","7443","24207","TLSv1.3","1479","","","","","Server Hello, Change Cipher Spec, Application Data, Application Data, Application Data, Application Data, Application Data"
"7","0.226406","24207","7443","TCP","44","","","","","24207  >  7443 [ACK] Seq=518 Ack=1436 Win=2618112 Len=0"
"8","0.244691","24207","7443","TLSv1.3","108","","","","","Change Cipher Spec, Application Data"
"9","0.244719","7443","24207","TCP","44","","","","","7443  >  24207 [ACK] Seq=1436 Ack=582 Win=2619648 Len=0"
"10","0.253005","24207","7443","TLSv1.3","153","","","","","Application Data"
"11","0.253039","7443","24207","TCP","44","","","","","7443  >  24207 [ACK] Seq=1436 Ack=691 Win=2619392 Len=0"
"12","0.320465","7443","24207","TLSv1.3","1252","","","","","Application Data"
"13","0.320498","24207","7443","TCP","44","","","","","24207  >  7443 [ACK] Seq=691 Ack=2644 Win=2617088 Len=0"
"14","0.320525","7443","24207","TLSv1.3","2438","","","","","Application Data"
"15","0.320538","24207","7443","TCP","44","","","","","24207  >  7443 [ACK] Seq=691 Ack=5038 Win=2614528 Len=0"
"16","0.320553","7443","24207","TLSv1.3","604","","","","","Application Data"
"17","0.320565","24207","7443","TCP","44","","","","","24207  >  7443 [ACK] Seq=691 Ack=5598 Win=2614016 Len=0"
"18","0.320587","7443","24207","TLSv1.3","4810","","","","","Application Data"
"19","0.320601","24207","7443","TCP","44","","","","","24207  >  7443 [ACK] Seq=691 Ack=10364 Win=2609408 Len=0"
"20","0.320627","7443","24207","TLSv1.3","5996","","","","","Application Data"
"21","0.320642","24207","7443","TCP","44","","","","","24207  >  7443 [ACK] Seq=691 Ack=16316 Win=2603264 Len=0"
"22","0.320663","7443","24207","TLSv1.3","7182","","","","","Application Data"
"23","0.320680","24207","7443","TCP","44","","","","","24207  >  7443 [ACK] Seq=691 Ack=23454 Win=2596096 Len=0"
"24","0.320707","7443","24207","TLSv1.3","8368","","","","","Application Data"
"25","0.320730","24207","7443","TCP","44","","","","","24207  >  7443 [ACK] Seq=691 Ack=31778 Win=2587904 Len=0"
"26","0.320786","7443","24207","TLSv1.3","2865","","","","","Application Data"
"27","0.320799","24207","7443","TCP","44","","","","","24207  >  7443 [ACK] Seq=691 Ack=34599 Win=2585088 Len=0"
"28","0.320841","7443","24207","TLSv1.3","10740","","","","","Application Data"
"29","0.320859","24207","7443","TCP","44","","","","","24207  >  7443 [ACK] Seq=691 Ack=45295 Win=2574336 Len=0"
"30","0.320879","7443","24207","TLSv1.3","11926","","","","","Application Data"
"31","0.320898","24207","7443","TCP","44","","","","","24207  >  7443 [ACK] Seq=691 Ack=57177 Win=2562560 Len=0"
"32","0.320914","7443","24207","TLSv1.3","10300","","","","","Application Data"
"33","0.320932","24207","7443","TCP","44","","","","","24207  >  7443 [ACK] Seq=691 Ack=67433 Win=2552320 Len=0"
"34","0.320955","24207","7443","TCP","44","","","","","[TCP Window Update] 24207  >  7443 [ACK] Seq=691 Ack=67433 Win=2619648 Len=0"
"35","0.320966","7443","24207","TLSv1.3","14298","","","","","Application Data"
"36","0.320986","24207","7443","TCP","44","","","","","24207  >  7443 [ACK] Seq=691 Ack=81687 Win=2605312 Len=0"
"37","0.321007","7443","24207","TLSv1.3","15484","","","","","Application Data"
"38","0.321026","24207","7443","TCP","44","","","","","24207  >  7443 [ACK] Seq=691 Ack=97127 Win=2589952 Len=0"
"39","0.321039","7443","24207","TLSv1.3","3184","","","","","Application Data"
"40","0.321052","24207","7443","TCP","44","","","","","24207  >  7443 [ACK] Seq=691 Ack=100267 Win=2586880 Len=0"
"41","0.321083","7443","24207","TLSv1.3","16450","","","","","Application Data"
"42","0.321106","24207","7443","TCP","44","","","","","24207  >  7443 [ACK] Seq=691 Ack=116673 Win=2570496 Len=0"
"43","0.321125","7443","24207","TLSv1.3","16450","","","","","Application Data"
"44","0.321146","24207","7443","TCP","44","","","","","24207  >  7443 [ACK] Seq=691 Ack=133079 Win=2554112 Len=0"
"45","0.321181","7443","24207","TLSv1.3","16450","","","","","Application Data"
"46","0.321211","24207","7443","TCP","44","","","","","[TCP Window Update] 24207  >  7443 [ACK] Seq=691 Ack=133079 Win=2619648 Len=0"
"47","0.321223","24207","7443","TCP","44","","","","","24207  >  7443 [ACK] Seq=691 Ack=149485 Win=2603264 Len=0"
"48","0.321217","7443","24207","TLSv1.3","16450","","","","","Application Data"
"49","0.321239","24207","7443","TCP","44","","","","","24207  >  7443 [ACK] Seq=691 Ack=165891 Win=2586880 Len=0"
"50","0.321274","7443","24207","TLSv1.3","16450","","","","","Application Data"
"51","0.321293","24207","7443","TCP","44","","","","","24207  >  7443 [ACK] Seq=691 Ack=182297 Win=2570496 Len=0"
"52","0.321312","7443","24207","TLSv1.3","16450","","","","","Application Data"
"53","0.321332","24207","7443","TCP","44","","","","","24207  >  7443 [ACK] Seq=691 Ack=198703 Win=2554112 Len=0"
"54","0.321367","7443","24207","TLSv1.3","16450","","","","","Application Data"
"55","0.321391","24207","7443","TCP","44","","","","","24207  >  7443 [ACK] Seq=691 Ack=215109 Win=2537728 Len=0"
"56","0.321411","7443","24207","TLSv1.3","16450","","","","","Application Data"
"57","0.321430","24207","7443","TCP","44","","","","","24207  >  7443 [ACK] Seq=691 Ack=231515 Win=2521088 Len=0"
"58","0.321463","7443","24207","TLSv1.3","16450","","","","","Application Data"
"59","0.321484","24207","7443","TCP","44","","","","","24207  >  7443 [ACK] Seq=691 Ack=247921 Win=2504704 Len=0"
"60","0.321502","7443","24207","TLSv1.3","16450","","","","","Application Data"
"61","0.321536","24207","7443","TCP","44","","","","","24207  >  7443 [ACK] Seq=691 Ack=264327 Win=2488320 Len=0"
"62","0.321572","7443","24207","TLSv1.3","16450","","","","","Application Data"
"63","0.321599","24207","7443","TCP","44","","","","","24207  >  7443 [ACK] Seq=691 Ack=280733 Win=2471936 Len=0"
"64","0.321631","7443","24207","TLSv1.3","16450","","","","","Application Data"
"65","0.321677","24207","7443","TCP","44","","","","","24207  >  7443 [ACK] Seq=691 Ack=297139 Win=2455552 Len=0"
"66","0.321718","7443","24207","TLSv1.3","16450","","","","","Application Data"
"67","0.321745","24207","7443","TCP","44","","","","","24207  >  7443 [ACK] Seq=691 Ack=313545 Win=2439168 Len=0"
"68","0.321764","7443","24207","TLSv1.3","16450","","","","","Application Data"
"69","0.321793","24207","7443","TCP","44","","","","","24207  >  7443 [ACK] Seq=691 Ack=329951 Win=2422784 Len=0"
"70","0.321827","7443","24207","TLSv1.3","16450","","","","","Application Data"
"71","0.321855","24207","7443","TCP","44","","","","","24207  >  7443 [ACK] Seq=691 Ack=346357 Win=2406400 Len=0"
"72","0.321874","7443","24207","TLSv1.3","16450","","","","","Application Data"
"73","0.321899","24207","7443","TCP","44","","","","","24207  >  7443 [ACK] Seq=691 Ack=362763 Win=2390016 Len=0"
"74","0.321931","7443","24207","TLSv1.3","16450","","","","","Application Data"
"75","0.321960","24207","7443","TCP","44","","","","","24207  >  7443 [ACK] Seq=691 Ack=379169 Win=2373632 Len=0"
"76","0.321979","7443","24207","TLSv1.3","16450","","","","","Application Data"
"77","0.322002","24207","7443","TCP","44","","","","","24207  >  7443 [ACK] Seq=691 Ack=395575 Win=2357248 Len=0"
"78","0.322034","7443","24207","TLSv1.3","16450","","","","","Application Data"
"79","0.322062","24207","7443","TCP","44","","","","","24207  >  7443 [ACK] Seq=691 Ack=411981 Win=2340864 Len=0"
"80","0.322080","7443","24207","TLSv1.3","16450","","","","","Application Data"
"81","0.322110","24207","7443","TCP","44","","","","","24207  >  7443 [ACK] Seq=691 Ack=428387 Win=2324224 Len=0"
"82","0.322152","7443","24207","TLSv1.3","16450","","","","","Application Data"
"83","0.322199","24207","7443","TCP","44","","","","","[TCP Window Update] 24207  >  7443 [ACK] Seq=691 Ack=428387 Win=2390016 Len=0"
"84","0.322213","24207","7443","TCP","44","","","","","24207  >  7443 [ACK] Seq=691 Ack=444793 Win=2373632 Len=0"
"85","0.322206","7443","24207","TLSv1.3","16450","","","","","Application Data"
"86","0.322240","24207","7443","TCP","44","","","","","24207  >  7443 [ACK] Seq=691 Ack=461199 Win=2357248 Len=0"
"87","0.322272","24207","7443","TCP","44","","","","","[TCP Window Update] 24207  >  7443 [ACK] Seq=691 Ack=461199 Win=2422784 Len=0"
"88","0.322280","7443","24207","TLSv1.3","16450","","","","","Application Data"
"89","0.322307","7443","24207","TLSv1.3","16450","","","","","Application Data"
"90","0.322357","24207","7443","TCP","44","","","","","24207  >  7443 [ACK] Seq=691 Ack=494011 Win=2455296 Len=0"
"91","0.322352","7443","24207","TLSv1.3","16450","","","","","Application Data"
"92","0.322382","24207","7443","TCP","44","","","","","24207  >  7443 [ACK] Seq=691 Ack=510417 Win=2438912 Len=0"
"93","0.322411","7443","24207","TLSv1.3","16450","","","","","Application Data"
"94","0.322427","24207","7443","TCP","44","","","","","[TCP Window Update] 24207  >  7443 [ACK] Seq=691 Ack=510417 Win=2504448 Len=0"
"95","0.322453","24207","7443","TCP","44","","","","","24207  >  7443 [ACK] Seq=691 Ack=526823 Win=2488064 Len=0"
"96","0.322492","24207","7443","TCP","44","","","","","[TCP Window Update] 24207  >  7443 [ACK] Seq=691 Ack=526823 Win=2553600 Len=0"
"97","0.322504","7443","24207","TLSv1.3","16450","","","","","Application Data"
"98","0.322532","24207","7443","TCP","44","","","","","24207  >  7443 [ACK] Seq=691 Ack=543229 Win=2537216 Len=0"
"99","0.322554","7443","24207","TLSv1.3","16450","","","","","Application Data"
"100","0.322572","24207","7443","TCP","44","","","","","24207  >  7443 [ACK] Seq=691 Ack=559635 Win=2520832 Len=0"
"101","0.322604","24207","7443","TCP","44","","","","","[TCP Window Update] 24207  >  7443 [ACK] Seq=691 Ack=559635 Win=2586368 Len=0"
"102","0.322607","7443","24207","TLSv1.3","16450","","","","","Application Data"
"103","0.322629","24207","7443","TCP","44","","","","","24207  >  7443 [ACK] Seq=691 Ack=576041 Win=2569984 Len=0"
"104","0.322647","7443","24207","TLSv1.3","16450","","","","","Application Data"
"105","0.322670","24207","7443","TCP","44","","","","","24207  >  7443 [ACK] Seq=691 Ack=592447 Win=2553600 Len=0"
"106","0.322705","7443","24207","TLSv1.3","16450","","","","","Application Data"
"107","0.322726","24207","7443","TCP","44","","","","","24207  >  7443 [ACK] Seq=691 Ack=608853 Win=2537216 Len=0"
"108","0.322744","7443","24207","TLSv1.3","16450","","","","","Application Data"
"109","0.322763","24207","7443","TCP","44","","","","","24207  >  7443 [ACK] Seq=691 Ack=625259 Win=2520832 Len=0"
"110","0.322795","7443","24207","TLSv1.3","16450","","","","","Application Data"
"111","0.322814","24207","7443","TCP","44","","","","","24207  >  7443 [ACK] Seq=691 Ack=641665 Win=2504448 Len=0"
"112","0.322833","7443","24207","TLSv1.3","16450","","","","","Application Data"
"113","0.322876","24207","7443","TCP","44","","","","","24207  >  7443 [ACK] Seq=691 Ack=658071 Win=2488064 Len=0"
"114","0.322908","7443","24207","TLSv1.3","16450","","","","","Application Data"
"115","0.322928","24207","7443","TCP","44","","","","","24207  >  7443 [ACK] Seq=691 Ack=674477 Win=2471680 Len=0"
"116","0.322946","7443","24207","TLSv1.3","16450","","","","","Application Data"
"117","0.322964","24207","7443","TCP","44","","","","","24207  >  7443 [ACK] Seq=691 Ack=690883 Win=2455040 Len=0"
"118","0.322996","7443","24207","TLSv1.3","16450","","","","","Application Data"
"119","0.323016","24207","7443","TCP","44","","","","","24207  >  7443 [ACK] Seq=691 Ack=707289 Win=2438656 Len=0"
"120","0.323034","7443","24207","TLSv1.3","16450","","","","","Application Data"
"121","0.323053","24207","7443","TCP","44","","","","","24207  >  7443 [ACK] Seq=691 Ack=723695 Win=2422272 Len=0"
"122","0.323083","7443","24207","TLSv1.3","16450","","","","","Application Data"
"123","0.323104","24207","7443","TCP","44","","","","","24207  >  7443 [ACK] Seq=691 Ack=740101 Win=2405888 Len=0"
"124","0.323154","7443","24207","TLSv1.3","16450","","","","","Application Data"
"125","0.323173","24207","7443","TCP","44","","","","","24207  >  7443 [ACK] Seq=691 Ack=756507 Win=2389504 Len=0"
"126","0.323209","7443","24207","TLSv1.3","16450","","","","","Application Data"
"127","0.323232","24207","7443","TCP","44","","","","","24207  >  7443 [ACK] Seq=691 Ack=772913 Win=2373120 Len=0"
"128","0.323253","7443","24207","TLSv1.3","16450","","","","","Application Data"
"129","0.323274","24207","7443","TCP","44","","","","","24207  >  7443 [ACK] Seq=691 Ack=789319 Win=2356736 Len=0"
"130","0.323309","7443","24207","TLSv1.3","16450","","","","","Application Data"
"131","0.323329","24207","7443","TCP","44","","","","","24207  >  7443 [ACK] Seq=691 Ack=805725 Win=2340352 Len=0"
"132","0.323348","7443","24207","TLSv1.3","16450","","","","","Application Data"
"133","0.323371","24207","7443","TCP","44","","","","","24207  >  7443 [ACK] Seq=691 Ack=822131 Win=2323968 Len=0"
"134","0.323401","7443","24207","TLSv1.3","16450","","","","","Application Data"
"135","0.323423","24207","7443","TCP","44","","","","","24207  >  7443 [ACK] Seq=691 Ack=838537 Win=2307584 Len=0"
"136","0.323441","7443","24207","TLSv1.3","16450","","","","","Application Data"
"137","0.323461","24207","7443","TCP","44","","","","","24207  >  7443 [ACK] Seq=691 Ack=854943 Win=2291200 Len=0"
"138","0.323491","7443","24207","TLSv1.3","16450","","","","","Application Data"
"139","0.323531","24207","7443","TCP","44","","","","","24207  >  7443 [ACK] Seq=691 Ack=871349 Win=2274560 Len=0"
"140","0.323550","7443","24207","TLSv1.3","16450","","","","","Application Data"
"141","0.323570","24207","7443","TCP","44","","","","","24207  >  7443 [ACK] Seq=691 Ack=887755 Win=2258176 Len=0"
"142","0.323600","7443","24207","TLSv1.3","16450","","","","","Application Data"
"143","0.323621","24207","7443","TCP","44","","","","","24207  >  7443 [ACK] Seq=691 Ack=904161 Win=2241792 Len=0"
"144","0.323639","7443","24207","TLSv1.3","16450","","","","","Application Data"
"145","0.323659","24207","7443","TCP","44","","","","","24207  >  7443 [ACK] Seq=691 Ack=920567 Win=2225408 Len=0"
"146","0.323689","7443","24207","TLSv1.3","16450","","","","","Application Data"
"147","0.323709","24207","7443","TCP","44","","","","","24207  >  7443 [ACK] Seq=691 Ack=936973 Win=2209024 Len=0"
"148","0.323730","7443","24207","TLSv1.3","16450","","","","","Application Data"
"149","0.323751","24207","7443","TCP","44","","","","","24207  >  7443 [ACK] Seq=691 Ack=953379 Win=2192640 Len=0"
"150","0.323796","7443","24207","TLSv1.3","16450","","","","","Application Data"
"151","0.323816","24207","7443","TCP","44","","","","","24207  >  7443 [ACK] Seq=691 Ack=969785 Win=2176256 Len=0"
"152","0.323835","7443","24207","TLSv1.3","16450","","","","","Application Data"
"153","0.323855","24207","7443","TCP","44","","","","","24207  >  7443 [ACK] Seq=691 Ack=986191 Win=2159872 Len=0"
"154","0.323886","7443","24207","TLSv1.3","16450","","","","","Application Data"
"155","0.323906","24207","7443","TCP","44","","","","","24207  >  7443 [ACK] Seq=691 Ack=1002597 Win=2143488 Len=0"
"156","0.323925","7443","24207","TLSv1.3","16450","","","","","Application Data"
"157","0.323945","24207","7443","TCP","44","","","","","24207  >  7443 [ACK] Seq=691 Ack=1019003 Win=2127104 Len=0"
"158","0.323975","7443","24207","TLSv1.3","16450","","","","","Application Data"
"159","0.323995","24207","7443","TCP","44","","","","","24207  >  7443 [ACK] Seq=691 Ack=1035409 Win=2110720 Len=0"
"160","0.324014","7443","24207","TLSv1.3","16450","","","","","Application Data"
"161","0.324033","24207","7443","TCP","44","","","","","24207  >  7443 [ACK] Seq=691 Ack=1051815 Win=2094336 Len=0"
"162","0.324119","7443","24207","TLSv1.3","16450","","","","","Application Data"
"163","0.324140","24207","7443","TCP","44","","","","","24207  >  7443 [ACK] Seq=691 Ack=1068221 Win=2077696 Len=0"
"164","0.324159","7443","24207","TLSv1.3","16450","","","","","Application Data"
"165","0.324200","24207","7443","TCP","44","","","","","24207  >  7443 [ACK] Seq=691 Ack=1084627 Win=2061312 Len=0"
"166","0.324231","7443","24207","TLSv1.3","16450","","","","","Application Data"
"167","0.324256","24207","7443","TCP","44","","","","","24207  >  7443 [ACK] Seq=691 Ack=1101033 Win=2044928 Len=0"
"168","0.324278","7443","24207","TLSv1.3","16450","","","","","Application Data"
"169","0.324298","24207","7443","TCP","44","","","","","24207  >  7443 [ACK] Seq=691 Ack=1117439 Win=2028544 Len=0"
"170","0.324329","7443","24207","TLSv1.3","16450","","","","","Application Data"
"171","0.324349","24207","7443","TCP","44","","","","","24207  >  7443 [ACK] Seq=691 Ack=1133845 Win=2012160 Len=0"
"172","0.324367","7443","24207","TLSv1.3","16450","","","","","Application Data"
"173","0.324388","24207","7443","TCP","44","","","","","24207  >  7443 [ACK] Seq=691 Ack=1150251 Win=1995776 Len=0"
"174","0.324417","7443","24207","TLSv1.3","16450","","","","","Application Data"
"175","0.324438","24207","7443","TCP","44","","","","","24207  >  7443 [ACK] Seq=691 Ack=1166657 Win=1979392 Len=0"
"176","0.324456","7443","24207","TLSv1.3","16450","","","","","Application Data"
"177","0.324476","24207","7443","TCP","44","","","","","24207  >  7443 [ACK] Seq=691 Ack=1183063 Win=1963008 Len=0"
"178","0.324505","7443","24207","TLSv1.3","16450","","","","","Application Data"
"179","0.324527","24207","7443","TCP","44","","","","","24207  >  7443 [ACK] Seq=691 Ack=1199469 Win=1946624 Len=0"
"180","0.324545","7443","24207","TLSv1.3","16450","","","","","Application Data"
"181","0.324567","24207","7443","TCP","44","","","","","24207  >  7443 [ACK] Seq=691 Ack=1215875 Win=1930240 Len=0"
"182","0.324597","7443","24207","TLSv1.3","16450","","","","","Application Data"
"183","0.324619","24207","7443","TCP","44","","","","","24207  >  7443 [ACK] Seq=691 Ack=1232281 Win=1913856 Len=0"
"184","0.324637","7443","24207","TLSv1.3","16450","","","","","Application Data"
"185","0.324656","24207","7443","TCP","44","","","","","24207  >  7443 [ACK] Seq=691 Ack=1248687 Win=1897472 Len=0"
"186","0.324686","7443","24207","TLSv1.3","16450","","","","","Application Data"
"187","0.324707","24207","7443","TCP","44","","","","","24207  >  7443 [ACK] Seq=691 Ack=1265093 Win=1880832 Len=0"
"188","0.324725","7443","24207","TLSv1.3","16450","","","","","Application Data"
"189","0.324744","24207","7443","TCP","44","","","","","24207  >  7443 [ACK] Seq=691 Ack=1281499 Win=1864448 Len=0"
"190","0.324776","7443","24207","TLSv1.3","16450","","","","","Application Data"
"191","0.324799","24207","7443","TCP","44","","","","","24207  >  7443 [ACK] Seq=691 Ack=1297905 Win=1848064 Len=0"
"192","0.324817","7443","24207","TLSv1.3","16450","","","","","Application Data"
"193","0.324838","24207","7443","TCP","44","","","","","24207  >  7443 [ACK] Seq=691 Ack=1314311 Win=1831680 Len=0"
"194","0.324869","7443","24207","TLSv1.3","16450","","","","","Application Data"
"195","0.324890","24207","7443","TCP","44","","","","","24207  >  7443 [ACK] Seq=691 Ack=1330717 Win=1815296 Len=0"
"196","0.324909","7443","24207","TLSv1.3","16450","","","","","Application Data"
"197","0.324929","24207","7443","TCP","44","","","","","24207  >  7443 [ACK] Seq=691 Ack=1347123 Win=1798912 Len=0"
"198","0.324959","7443","24207","TLSv1.3","16450","","","","","Application Data"
"199","0.324981","24207","7443","TCP","44","","","","","24207  >  7443 [ACK] Seq=691 Ack=1363529 Win=1782528 Len=0"
"200","0.324999","7443","24207","TLSv1.3","16450","","","","","Application Data"
"201","0.325018","24207","7443","TCP","44","","","","","24207  >  7443 [ACK] Seq=691 Ack=1379935 Win=1766144 Len=0"
"202","0.325048","7443","24207","TLSv1.3","16450","","","","","Application Data"
"203","0.325071","24207","7443","TCP","44","","","","","24207  >  7443 [ACK] Seq=691 Ack=1396341 Win=1749760 Len=0"
"204","0.325089","7443","24207","TLSv1.3","16450","","","","","Application Data"
"205","0.325109","24207","7443","TCP","44","","","","","24207  >  7443 [ACK] Seq=691 Ack=1412747 Win=1733376 Len=0"
"206","0.325139","7443","24207","TLSv1.3","16450","","","","","Application Data"
"207","0.325160","24207","7443","TCP","44","","","","","24207  >  7443 [ACK] Seq=691 Ack=1429153 Win=1716992 Len=0"
"208","0.325178","7443","24207","TLSv1.3","16450","","","","","Application Data"
"209","0.325197","24207","7443","TCP","44","","","","","24207  >  7443 [ACK] Seq=691 Ack=1445559 Win=1700352 Len=0"
"210","0.325227","7443","24207","TLSv1.3","16450","","","","","Application Data"
"211","0.325248","24207","7443","TCP","44","","","","","24207  >  7443 [ACK] Seq=691 Ack=1461965 Win=1683968 Len=0"
"212","0.325266","7443","24207","TLSv1.3","16450","","","","","Application Data"
"213","0.325286","24207","7443","TCP","44","","","","","24207  >  7443 [ACK] Seq=691 Ack=1478371 Win=1667584 Len=0"
"214","0.325419","7443","24207","TLSv1.3","16450","","","","","Application Data"
"215","0.325446","24207","7443","TCP","44","","","","","24207  >  7443 [ACK] Seq=691 Ack=1494777 Win=1651200 Len=0"
"216","0.325472","7443","24207","TLSv1.3","16450","","","","","Application Data"
"217","0.325494","24207","7443","TCP","44","","","","","24207  >  7443 [ACK] Seq=691 Ack=1511183 Win=1634816 Len=0"
"218","0.325536","7443","24207","TLSv1.3","16450","","","","","Application Data"
"219","0.325559","24207","7443","TCP","44","","","","","24207  >  7443 [ACK] Seq=691 Ack=1527589 Win=1618432 Len=0"
"220","0.325578","7443","24207","TLSv1.3","16450","","","","","Application Data"
"221","0.325600","24207","7443","TCP","44","","","","","24207  >  7443 [ACK] Seq=691 Ack=1543995 Win=1602048 Len=0"
"222","0.325631","7443","24207","TLSv1.3","16450","","","","","Application Data"
"223","0.325654","24207","7443","TCP","44","","","","","24207  >  7443 [ACK] Seq=691 Ack=1560401 Win=1585664 Len=0"
"224","0.325672","7443","24207","TLSv1.3","16450","","","","","Application Data"
"225","0.325692","24207","7443","TCP","44","","","","","24207  >  7443 [ACK] Seq=691 Ack=1576807 Win=1569280 Len=0"
"226","0.325724","7443","24207","TLSv1.3","16450","","","","","Application Data"
"227","0.325746","24207","7443","TCP","44","","","","","24207  >  7443 [ACK] Seq=691 Ack=1593213 Win=1552896 Len=0"
"228","0.325764","7443","24207","TLSv1.3","16450","","","","","Application Data"
"229","0.325786","24207","7443","TCP","44","","","","","24207  >  7443 [ACK] Seq=691 Ack=1609619 Win=1536512 Len=0"
"230","0.325816","7443","24207","TLSv1.3","16450","","","","","Application Data"
"231","0.325837","24207","7443","TCP","44","","","","","24207  >  7443 [ACK] Seq=691 Ack=1626025 Win=1520128 Len=0"
"232","0.325855","7443","24207","TLSv1.3","16450","","","","","Application Data"
"233","0.325878","24207","7443","TCP","44","","","","","24207  >  7443 [ACK] Seq=691 Ack=1642431 Win=1503488 Len=0"
"234","0.325923","7443","24207","TLSv1.3","16450","","","","","Application Data"
"235","0.325951","24207","7443","TCP","44","","","","","24207  >  7443 [ACK] Seq=691 Ack=1658837 Win=1487104 Len=0"
"236","0.325982","7443","24207","TLSv1.3","16450","","","","","Application Data"
"237","0.326009","24207","7443","TCP","44","","","","","24207  >  7443 [ACK] Seq=691 Ack=1675243 Win=1470720 Len=0"
"238","0.326056","7443","24207","TLSv1.3","16450","","","","","Application Data"
"239","0.326087","24207","7443","TCP","44","","","","","24207  >  7443 [ACK] Seq=691 Ack=1691649 Win=1454336 Len=0"
"240","0.326108","7443","24207","TLSv1.3","16450","","","","","Application Data"
"241","0.326129","24207","7443","TCP","44","","","","","24207  >  7443 [ACK] Seq=691 Ack=1708055 Win=1437952 Len=0"
"242","0.326164","7443","24207","TLSv1.3","16450","","","","","Application Data"
"243","0.326185","24207","7443","TCP","44","","","","","24207  >  7443 [ACK] Seq=691 Ack=1724461 Win=1421568 Len=0"
"244","0.326203","7443","24207","TLSv1.3","16450","","","","","Application Data"
"245","0.326223","24207","7443","TCP","44","","","","","24207  >  7443 [ACK] Seq=691 Ack=1740867 Win=1405184 Len=0"
"246","0.326252","7443","24207","TLSv1.3","16450","","","","","Application Data"
"247","0.326274","24207","7443","TCP","44","","","","","24207  >  7443 [ACK] Seq=691 Ack=1757273 Win=1388800 Len=0"
"248","0.326292","7443","24207","TLSv1.3","16450","","","","","Application Data"
"249","0.326313","24207","7443","TCP","44","","","","","24207  >  7443 [ACK] Seq=691 Ack=1773679 Win=1372416 Len=0"
"250","0.326343","7443","24207","TLSv1.3","16450","","","","","Application Data"
"251","0.326364","24207","7443","TCP","44","","","","","24207  >  7443 [ACK] Seq=691 Ack=1790085 Win=1356032 Len=0"
"252","0.326382","7443","24207","TLSv1.3","16450","","","","","Application Data"
"253","0.326402","24207","7443","TCP","44","","","","","24207  >  7443 [ACK] Seq=691 Ack=1806491 Win=1339648 Len=0"
"254","0.326432","7443","24207","TLSv1.3","16450","","","","","Application Data"
"255","0.326452","24207","7443","TCP","44","","","","","24207  >  7443 [ACK] Seq=691 Ack=1822897 Win=1323264 Len=0"
"256","0.326474","7443","24207","TLSv1.3","16450","","","","","Application Data"
"257","0.326498","24207","7443","TCP","44","","","","","24207  >  7443 [ACK] Seq=691 Ack=1839303 Win=1306624 Len=0"
"258","0.326531","7443","24207","TLSv1.3","16450","","","","","Application Data"
"259","0.326552","24207","7443","TCP","44","","","","","24207  >  7443 [ACK] Seq=691 Ack=1855709 Win=1290240 Len=0"
"260","0.326570","7443","24207","TLSv1.3","16450","","","","","Application Data"
"261","0.326590","24207","7443","TCP","44","","","","","24207  >  7443 [ACK] Seq=691 Ack=1872115 Win=1273856 Len=0"
"262","0.326620","7443","24207","TLSv1.3","16450","","","","","Application Data"
"263","0.326642","24207","7443","TCP","44","","","","","24207  >  7443 [ACK] Seq=691 Ack=1888521 Win=1257472 Len=0"
"264","0.326659","7443","24207","TLSv1.3","16450","","","","","Application Data"
"265","0.326679","24207","7443","TCP","44","","","","","24207  >  7443 [ACK] Seq=691 Ack=1904927 Win=1241088 Len=0"
"266","0.326725","7443","24207","TLSv1.3","16450","","","","","Application Data"
"267","0.326748","24207","7443","TCP","44","","","","","24207  >  7443 [ACK] Seq=691 Ack=1921333 Win=1224704 Len=0"
"268","0.326766","7443","24207","TLSv1.3","16450","","","","","Application Data"
"269","0.326787","24207","7443","TCP","44","","","","","24207  >  7443 [ACK] Seq=691 Ack=1937739 Win=1208320 Len=0"
"270","0.326818","7443","24207","TLSv1.3","16450","","","","","Application Data"
"271","0.326838","24207","7443","TCP","44","","","","","24207  >  7443 [ACK] Seq=691 Ack=1954145 Win=1191936 Len=0"
"272","0.326856","7443","24207","TLSv1.3","16450","","","","","Application Data"
"273","0.326876","24207","7443","TCP","44","","","","","24207  >  7443 [ACK] Seq=691 Ack=1970551 Win=1175552 Len=0"
"274","0.326906","7443","24207","TLSv1.3","16450","","","","","Application Data"
"275","0.326927","24207","7443","TCP","44","","","","","24207  >  7443 [ACK] Seq=691 Ack=1986957 Win=1159168 Len=0"
"276","0.326945","7443","24207","TLSv1.3","16450","","","","","Application Data"
"277","0.326965","24207","7443","TCP","44","","","","","24207  >  7443 [ACK] Seq=691 Ack=2003363 Win=1142784 Len=0"
"278","0.326995","7443","24207","TLSv1.3","16450","","","","","Application Data"
"279","0.327021","24207","7443","TCP","44","","","","","24207  >  7443 [ACK] Seq=691 Ack=2019769 Win=1126144 Len=0"
"280","0.327042","7443","24207","TLSv1.3","16450","","","","","Application Data"
"281","0.327062","24207","7443","TCP","44","","","","","24207  >  7443 [ACK] Seq=691 Ack=2036175 Win=1109760 Len=0"
"282","0.327093","7443","24207","TLSv1.3","16450","","","","","Application Data"
"283","0.327117","24207","7443","TCP","44","","","","","24207  >  7443 [ACK] Seq=691 Ack=2052581 Win=1093376 Len=0"
"284","0.327135","7443","24207","TLSv1.3","16450","","","","","Application Data"
"285","0.327155","24207","7443","TCP","44","","","","","24207  >  7443 [ACK] Seq=691 Ack=2068987 Win=1076992 Len=0"
"286","0.327185","7443","24207","TLSv1.3","16450","","","","","Application Data"
"287","0.327206","24207","7443","TCP","44","","","","","24207  >  7443 [ACK] Seq=691 Ack=2085393 Win=1060608 Len=0"
"288","0.327224","7443","24207","TLSv1.3","16450","","","","","Application Data"
"289","0.327245","24207","7443","TCP","44","","","","","24207  >  7443 [ACK] Seq=691 Ack=2101799 Win=1044224 Len=0"
"290","0.327331","7443","24207","TLSv1.3","16450","","","","","Application Data"
"291","0.327353","24207","7443","TCP","44","","","","","24207  >  7443 [ACK] Seq=691 Ack=2118205 Win=1027840 Len=0"
"292","0.327372","7443","24207","TLSv1.3","16450","","","","","Application Data"
"293","0.327391","24207","7443","TCP","44","","","","","24207  >  7443 [ACK] Seq=691 Ack=2134611 Win=1011456 Len=0"
"294","0.327421","7443","24207","TLSv1.3","16450","","","","","Application Data"
"295","0.327443","24207","7443","TCP","44","","","","","24207  >  7443 [ACK] Seq=691 Ack=2151017 Win=995072 Len=0"
"296","0.327461","7443","24207","TLSv1.3","16450","","","","","Application Data"
"297","0.327482","24207","7443","TCP","44","","","","","24207  >  7443 [ACK] Seq=691 Ack=2167423 Win=978688 Len=0"
"298","0.327512","7443","24207","TLSv1.3","16450","","","","","Application Data"
"299","0.327534","24207","7443","TCP","44","","","","","24207  >  7443 [ACK] Seq=691 Ack=2183829 Win=962304 Len=0"
"300","0.327557","7443","24207","TLSv1.3","16450","","","","","Application Data"
"301","0.327580","24207","7443","TCP","44","","","","","24207  >  7443 [ACK] Seq=691 Ack=2200235 Win=945920 Len=0"
"302","0.327611","7443","24207","TLSv1.3","16450","","","","","Application Data"
"303","0.327636","24207","7443","TCP","44","","","","","24207  >  7443 [ACK] Seq=691 Ack=2216641 Win=929280 Len=0"
"304","0.327655","7443","24207","TLSv1.3","16450","","","","","Application Data"
"305","0.327678","24207","7443","TCP","44","","","","","24207  >  7443 [ACK] Seq=691 Ack=2233047 Win=912896 Len=0"
"306","0.327709","7443","24207","TLSv1.3","16450","","","","","Application Data"
"307","0.327733","24207","7443","TCP","44","","","","","24207  >  7443 [ACK] Seq=691 Ack=2249453 Win=896512 Len=0"
"308","0.327751","7443","24207","TLSv1.3","16450","","","","","Application Data"
"309","0.327775","24207","7443","TCP","44","","","","","24207  >  7443 [ACK] Seq=691 Ack=2265859 Win=880128 Len=0"
"310","0.327805","7443","24207","TLSv1.3","16450","","","","","Application Data"
"311","0.327828","24207","7443","TCP","44","","","","","24207  >  7443 [ACK] Seq=691 Ack=2282265 Win=863744 Len=0"
"312","0.327846","7443","24207","TLSv1.3","16450","","","","","Application Data"
"313","0.327869","24207","7443","TCP","44","","","","","24207  >  7443 [ACK] Seq=691 Ack=2298671 Win=847360 Len=0"
"314","0.327898","7443","24207","TLSv1.3","16450","","","","","Application Data"
"315","0.327922","24207","7443","TCP","44","","","","","24207  >  7443 [ACK] Seq=691 Ack=2315077 Win=830976 Len=0"
"316","0.327940","7443","24207","TLSv1.3","16450","","","","","Application Data"
"317","0.327961","24207","7443","TCP","44","","","","","24207  >  7443 [ACK] Seq=691 Ack=2331483 Win=814592 Len=0"
"318","0.327991","7443","24207","TLSv1.3","16450","","","","","Application Data"
"319","0.328015","24207","7443","TCP","44","","","","","24207  >  7443 [ACK] Seq=691 Ack=2347889 Win=798208 Len=0"
"320","0.328033","7443","24207","TLSv1.3","16450","","","","","Application Data"
"321","0.328056","24207","7443","TCP","44","","","","","24207  >  7443 [ACK] Seq=691 Ack=2364295 Win=781824 Len=0"
"322","0.328095","7443","24207","TLSv1.3","16450","","","","","Application Data"
"323","0.328121","24207","7443","TCP","44","","","","","24207  >  7443 [ACK] Seq=691 Ack=2380701 Win=765440 Len=0"
"324","0.328140","7443","24207","TLSv1.3","16450","","","","","Application Data"
"325","0.328164","24207","7443","TCP","44","","","","","24207  >  7443 [ACK] Seq=691 Ack=2397107 Win=748800 Len=0"
"326","0.328195","7443","24207","TLSv1.3","16450","","","","","Application Data"
"327","0.328221","24207","7443","TCP","44","","","","","24207  >  7443 [ACK] Seq=691 Ack=2413513 Win=732416 Len=0"
"328","0.328239","7443","24207","TLSv1.3","16450","","","","","Application Data"
"329","0.328261","24207","7443","TCP","44","","","","","24207  >  7443 [ACK] Seq=691 Ack=2429919 Win=716032 Len=0"
"330","0.328292","7443","24207","TLSv1.3","16450","","","","","Application Data"
"331","0.328316","24207","7443","TCP","44","","","","","24207  >  7443 [ACK] Seq=691 Ack=2446325 Win=699648 Len=0"
"332","0.328334","7443","24207","TLSv1.3","16450","","","","","Application Data"
"333","0.328357","24207","7443","TCP","44","","","","","24207  >  7443 [ACK] Seq=691 Ack=2462731 Win=683264 Len=0"
"334","0.328387","7443","24207","TLSv1.3","16450","","","","","Application Data"
"335","0.328411","24207","7443","TCP","44","","","","","24207  >  7443 [ACK] Seq=691 Ack=2479137 Win=666880 Len=0"
"336","0.328429","7443","24207","TLSv1.3","16450","","","","","Application Data"
"337","0.328453","24207","7443","TCP","44","","","","","24207  >  7443 [ACK] Seq=691 Ack=2495543 Win=650496 Len=0"
"338","0.328483","7443","24207","TLSv1.3","16450","","","","","Application Data"
"339","0.328507","24207","7443","TCP","44","","","","","24207  >  7443 [ACK] Seq=691 Ack=2511949 Win=634112 Len=0"
"340","0.328525","7443","24207","TLSv1.3","16450","","","","","Application Data"
"341","0.328547","24207","7443","TCP","44","","","","","24207  >  7443 [ACK] Seq=691 Ack=2528355 Win=617728 Len=0"
"342","0.328577","7443","24207","TLSv1.3","16450","","","","","Application Data"
"343","0.328600","24207","7443","TCP","44","","","","","24207  >  7443 [ACK] Seq=691 Ack=2544761 Win=601344 Len=0"
"344","0.328623","7443","24207","TLSv1.3","16450","","","","","Application Data"
"345","0.328649","24207","7443","TCP","44","","","","","24207  >  7443 [ACK] Seq=691 Ack=2561167 Win=584960 Len=0"
"346","0.328681","7443","24207","TLSv1.3","16450","","","","","Application Data"
"347","0.328705","24207","7443","TCP","44","","","","","24207  >  7443 [ACK] Seq=691 Ack=2577573 Win=568576 Len=0"
"348","0.328723","7443","24207","TLSv1.3","16450","","","","","Application Data"
"349","0.328746","24207","7443","TCP","44","","","","","24207  >  7443 [ACK] Seq=691 Ack=2593979 Win=551936 Len=0"
"350","0.328776","7443","24207","TLSv1.3","16450","","","","","Application Data"
"351","0.328799","24207","7443","TCP","44","","","","","24207  >  7443 [ACK] Seq=691 Ack=2610385 Win=535552 Len=0"
"352","0.328817","7443","24207","TLSv1.3","16450","","","","","Application Data"
"353","0.328839","24207","7443","TCP","44","","","","","24207  >  7443 [ACK] Seq=691 Ack=2626791 Win=519168 Len=0"
"354","0.328871","7443","24207","TLSv1.3","16450","","","","","Application Data"
"355","0.328897","24207","7443","TCP","44","","","","","24207  >  7443 [ACK] Seq=691 Ack=2643197 Win=502784 Len=0"
"356","0.328914","7443","24207","TLSv1.3","16450","","","","","Application Data"
"357","0.328938","24207","7443","TCP","44","","","","","24207  >  7443 [ACK] Seq=691 Ack=2659603 Win=486400 Len=0"
"358","0.328967","7443","24207","TLSv1.3","16450","","","","","Application Data"
"359","0.328991","24207","7443","TCP","44","","","","","24207  >  7443 [ACK] Seq=691 Ack=2676009 Win=470016 Len=0"
"360","0.329009","7443","24207","TLSv1.3","16450","","","","","Application Data"
"361","0.329031","24207","7443","TCP","44","","","","","24207  >  7443 [ACK] Seq=691 Ack=2692415 Win=453632 Len=0"
"362","0.329061","7443","24207","TLSv1.3","16450","","","","","Application Data"
"363","0.329084","24207","7443","TCP","44","","","","","24207  >  7443 [ACK] Seq=691 Ack=2708821 Win=437248 Len=0"
"364","0.329102","7443","24207","TLSv1.3","16450","","","","","Application Data"
"365","0.329125","24207","7443","TCP","44","","","","","24207  >  7443 [ACK] Seq=691 Ack=2725227 Win=420864 Len=0"
"366","0.329161","7443","24207","TLSv1.3","16450","","","","","Application Data"
"367","0.329188","24207","7443","TCP","44","","","","","24207  >  7443 [ACK] Seq=691 Ack=2741633 Win=404480 Len=0"
"368","0.329206","7443","24207","TLSv1.3","16450","","","","","Application Data"
"369","0.329229","24207","7443","TCP","44","","","","","24207  >  7443 [ACK] Seq=691 Ack=2758039 Win=388096 Len=0"
"370","0.329260","7443","24207","TLSv1.3","16450","","","","","Application Data"
"371","0.329284","24207","7443","TCP","44","","","","","24207  >  7443 [ACK] Seq=691 Ack=2774445 Win=371712 Len=0"
"372","0.329302","7443","24207","TLSv1.3","16450","","","","","Application Data"
"373","0.329326","24207","7443","TCP","44","","","","","24207  >  7443 [ACK] Seq=691 Ack=2790851 Win=355072 Len=0"
"374","0.329356","7443","24207","TLSv1.3","16450","","","","","Application Data"
"375","0.329382","24207","7443","TCP","44","","","","","24207  >  7443 [ACK] Seq=691 Ack=2807257 Win=338688 Len=0"
"376","0.329400","7443","24207","TLSv1.3","16450","","","","","Application Data"
"377","0.329423","24207","7443","TCP","44","","","","","24207  >  7443 [ACK] Seq=691 Ack=2823663 Win=322304 Len=0"
"378","0.329454","7443","24207","TLSv1.3","16450","","","","","Application Data"
"379","0.329477","24207","7443","TCP","44","","","","","24207  >  7443 [ACK] Seq=691 Ack=2840069 Win=305920 Len=0"
"380","0.329495","7443","24207","TLSv1.3","16450","","","","","Application Data"
"381","0.329517","24207","7443","TCP","44","","","","","24207  >  7443 [ACK] Seq=691 Ack=2856475 Win=289536 Len=0"
"382","0.329547","7443","24207","TLSv1.3","16450","","","","","Application Data"
"383","0.329570","24207","7443","TCP","44","","","","","24207  >  7443 [ACK] Seq=691 Ack=2872881 Win=273152 Len=0"
"384","0.329589","7443","24207","TLSv1.3","16450","","","","","Application Data"
"385","0.329614","24207","7443","TCP","44","","","","","24207  >  7443 [ACK] Seq=691 Ack=2889287 Win=256768 Len=0"
"386","0.329646","7443","24207","TLSv1.3","16450","","","","","Application Data"
"387","0.329672","24207","7443","TCP","44","","","","","24207  >  7443 [ACK] Seq=691 Ack=2905693 Win=240384 Len=0"
"388","0.329692","7443","24207","TLSv1.3","16450","","","","","Application Data"
"389","0.329715","24207","7443","TCP","44","","","","","24207  >  7443 [ACK] Seq=691 Ack=2922099 Win=224000 Len=0"
"390","0.329745","7443","24207","TLSv1.3","16450","","","","","Application Data"
"391","0.329770","24207","7443","TCP","44","","","","","24207  >  7443 [ACK] Seq=691 Ack=2938505 Win=207616 Len=0"
"392","0.329800","7443","24207","TLSv1.3","16450","","","","","Application Data"
"393","0.329825","24207","7443","TCP","44","","","","","24207  >  7443 [ACK] Seq=691 Ack=2954911 Win=191232 Len=0"
"394","0.329856","7443","24207","TLSv1.3","16450","","","","","Application Data"
"395","0.329879","24207","7443","TCP","44","","","","","24207  >  7443 [ACK] Seq=691 Ack=2971317 Win=174592 Len=0"
"396","0.329897","7443","24207","TLSv1.3","16450","","","","","Application Data"
"397","0.329919","24207","7443","TCP","44","","","","","24207  >  7443 [ACK] Seq=691 Ack=2987723 Win=158208 Len=0"
"398","0.329950","7443","24207","TLSv1.3","16450","","","","","Application Data"
"399","0.329982","24207","7443","TCP","44","","","","","24207  >  7443 [ACK] Seq=691 Ack=3004129 Win=141824 Len=0"
"400","0.330004","7443","24207","TLSv1.3","16450","","","","","Application Data"
"401","0.330028","24207","7443","TCP","44","","","","","24207  >  7443 [ACK] Seq=691 Ack=3020535 Win=125440 Len=0"
"402","0.330061","7443","24207","TLSv1.3","16450","","","","","Application Data"
"403","0.330085","24207","7443","TCP","44","","","","","24207  >  7443 [ACK] Seq=691 Ack=3036941 Win=109056 Len=0"
