"No.","Time","Source","Destination","Protocol","Length","Packet Type","Header Form","Connection Number","Stream index","Info"
"1","0.000000","23758","7443","TCP","56","","","","","23758  >  7443 [SYN] Seq=0 Win=65535 Len=0 MSS=65495 WS=256 SACK_PERM=1"
"2","0.000067","7443","23758","TCP","56","","","","","7443  >  23758 [SYN, ACK] Seq=0 Ack=1 Win=65535 Len=0 MSS=65495 WS=256 SACK_PERM=1"
"3","0.000182","23758","7443","TCP","44","","","","","23758  >  7443 [ACK] Seq=1 Ack=1 Win=2619648 Len=0"
"4","0.227135","23758","7443","TLSv1.3","561","","","","","Client Hello"
"5","0.227164","7443","23758","TCP","44","","","","","7443  >  23758 [ACK] Seq=1 Ack=518 Win=2619648 Len=0"
"6","0.228905","7443","23758","TLSv1.3","1480","","","","","Server Hello, Change Cipher Spec, Application Data, Application Data, Application Data, Application Data, Application Data"
"7","0.228934","23758","7443","TCP","44","","","","","23758  >  7443 [ACK] Seq=518 Ack=1437 Win=2618112 Len=0"
"8","0.255947","23758","7443","TLSv1.3","108","","","","","Change Cipher Spec, Application Data"
"9","0.255974","7443","23758","TCP","44","","","","","7443  >  23758 [ACK] Seq=1437 Ack=582 Win=2619648 Len=0"
"10","0.258699","23758","7443","TLSv1.3","153","","","","","Application Data"
"11","0.258716","7443","23758","TCP","44","","","","","7443  >  23758 [ACK] Seq=1437 Ack=691 Win=2619392 Len=0"
"12","0.328170","7443","23758","TLSv1.3","1252","","","","","Application Data"
"13","0.328197","23758","7443","TCP","44","","","","","23758  >  7443 [ACK] Seq=691 Ack=2645 Win=2617088 Len=0"
"14","0.328219","7443","23758","TLSv1.3","2438","","","","","Application Data"
"15","0.328232","23758","7443","TCP","44","","","","","23758  >  7443 [ACK] Seq=691 Ack=5039 Win=2614528 Len=0"
"16","0.328246","7443","23758","TLSv1.3","604","","","","","Application Data"
"17","0.328258","23758","7443","TCP","44","","","","","23758  >  7443 [ACK] Seq=691 Ack=5599 Win=2614016 Len=0"
"18","0.328278","7443","23758","TLSv1.3","4810","","","","","Application Data"
"19","0.328293","23758","7443","TCP","44","","","","","23758  >  7443 [ACK] Seq=691 Ack=10365 Win=2609408 Len=0"
"20","0.328307","7443","23758","TLSv1.3","5996","","","","","Application Data"
"21","0.328322","23758","7443","TCP","44","","","","","23758  >  7443 [ACK] Seq=691 Ack=16317 Win=2603264 Len=0"
"22","0.328339","7443","23758","TLSv1.3","7182","","","","","Application Data"
"23","0.328360","23758","7443","TCP","44","","","","","23758  >  7443 [ACK] Seq=691 Ack=23455 Win=2596096 Len=0"
"24","0.328389","7443","23758","TLSv1.3","8368","","","","","Application Data"
"25","0.328406","23758","7443","TCP","44","","","","","23758  >  7443 [ACK] Seq=691 Ack=31779 Win=2587904 Len=0"
"26","0.328419","7443","23758","TLSv1.3","2863","","","","","Application Data"
"27","0.328431","23758","7443","TCP","44","","","","","23758  >  7443 [ACK] Seq=691 Ack=34598 Win=2585088 Len=0"
"28","0.328466","7443","23758","TLSv1.3","10740","","","","","Application Data"
"29","0.328482","23758","7443","TCP","44","","","","","23758  >  7443 [ACK] Seq=691 Ack=45294 Win=2574336 Len=0"
"30","0.328507","7443","23758","TLSv1.3","11926","","","","","Application Data"
"31","0.328525","23758","7443","TCP","44","","","","","23758  >  7443 [ACK] Seq=691 Ack=57176 Win=2562560 Len=0"
"32","0.328540","7443","23758","TLSv1.3","10300","","","","","Application Data"
"33","0.328556","23758","7443","TCP","44","","","","","23758  >  7443 [ACK] Seq=691 Ack=67432 Win=2552320 Len=0"
"34","0.328578","23758","7443","TCP","44","","","","","[TCP Window Update] 23758  >  7443 [ACK] Seq=691 Ack=67432 Win=2619648 Len=0"
"35","0.328600","7443","23758","TLSv1.3","14298","","","","","Application Data"
"36","0.328621","23758","7443","TCP","44","","","","","23758  >  7443 [ACK] Seq=691 Ack=81686 Win=2605312 Len=0"
"37","0.328650","7443","23758","TLSv1.3","15484","","","","","Application Data"
"38","0.328669","23758","7443","TCP","44","","","","","23758  >  7443 [ACK] Seq=691 Ack=97126 Win=2589952 Len=0"
"39","0.328682","7443","23758","TLSv1.3","3184","","","","","Application Data"
"40","0.328693","23758","7443","TCP","44","","","","","23758  >  7443 [ACK] Seq=691 Ack=100266 Win=2586880 Len=0"
"41","0.328725","7443","23758","TLSv1.3","16450","","","","","Application Data"
"42","0.328747","23758","7443","TCP","44","","","","","23758  >  7443 [ACK] Seq=691 Ack=116672 Win=2570496 Len=0"
"43","0.328764","7443","23758","TLSv1.3","16450","","","","","Application Data"
"44","0.328785","23758","7443","TCP","44","","","","","23758  >  7443 [ACK] Seq=691 Ack=133078 Win=2554112 Len=0"
"45","0.328805","23758","7443","TCP","44","","","","","[TCP Window Update] 23758  >  7443 [ACK] Seq=691 Ack=133078 Win=2619648 Len=0"
"46","0.328815","7443","23758","TLSv1.3","16450","","","","","Application Data"
"47","0.328855","7443","23758","TLSv1.3","16450","","","","","Application Data"
"48","0.328872","23758","7443","TCP","44","","","","","23758  >  7443 [ACK] Seq=691 Ack=149484 Win=2603264 Len=0"
"49","0.328914","7443","23758","TLSv1.3","16450","","","","","Application Data"
"50","0.328927","7443","23758","TLSv1.3","16450","","","","","Application Data"
"51","0.328937","7443","23758","TLSv1.3","16450","","","","","Application Data"
"52","0.328946","23758","7443","TCP","44","","","","","23758  >  7443 [ACK] Seq=691 Ack=165890 Win=2586880 Len=0"
"53","0.328982","7443","23758","TLSv1.3","16450","","","","","Application Data"
"54","0.329001","7443","23758","TLSv1.3","16450","","","","","Application Data"
"55","0.329018","7443","23758","TLSv1.3","16450","","","","","Application Data"
"56","0.329026","23758","7443","TCP","44","","","","","23758  >  7443 [ACK] Seq=691 Ack=215108 Win=2537728 Len=0"
"57","0.329060","23758","7443","TCP","44","","","","","[TCP Window Update] 23758  >  7443 [ACK] Seq=691 Ack=215108 Win=2603264 Len=0"
"58","0.329063","7443","23758","TLSv1.3","16450","","","","","Application Data"
"59","0.329072","7443","23758","TLSv1.3","16450","","","","","Application Data"
"60","0.329082","7443","23758","TLSv1.3","16450","","","","","Application Data"
"61","0.329099","7443","23758","TLSv1.3","16450","","","","","Application Data"
"62","0.329119","23758","7443","TCP","44","","","","","23758  >  7443 [ACK] Seq=691 Ack=264326 Win=2554112 Len=0"
"63","0.329174","7443","23758","TLSv1.3","16450","","","","","Application Data"
"64","0.329184","7443","23758","TLSv1.3","16450","","","","","Application Data"
"65","0.329201","23758","7443","TCP","44","","","","","[TCP Window Update] 23758  >  7443 [ACK] Seq=691 Ack=264326 Win=2619648 Len=0"
"66","0.329207","7443","23758","TLSv1.3","16450","","","","","Application Data"
"67","0.329225","7443","23758","TLSv1.3","16450","","","","","Application Data"
"68","0.329235","7443","23758","TLSv1.3","16450","","","","","Application Data"
"69","0.329270","7443","23758","TLSv1.3","16450","","","","","Application Data"
"70","0.329288","23758","7443","TCP","44","","","","","23758  >  7443 [ACK] Seq=691 Ack=329950 Win=2553856 Len=0"
"71","0.329362","7443","23758","TLSv1.3","16450","","","","","Application Data"
"72","0.329378","7443","23758","TLSv1.3","16450","","","","","Application Data"
"73","0.329389","23758","7443","TCP","44","","","","","[TCP Window Update] 23758  >  7443 [ACK] Seq=691 Ack=329950 Win=2619648 Len=0"
"74","0.329392","7443","23758","TLSv1.3","16450","","","","","Application Data"
"75","0.329400","7443","23758","TLSv1.3","16450","","","","","Application Data"
"76","0.329409","7443","23758","TLSv1.3","16450","","","","","Application Data"
"77","0.329418","7443","23758","TLSv1.3","16450","","","","","Application Data"
"78","0.329426","7443","23758","TLSv1.3","16450","","","","","Application Data"
"79","0.329435","7443","23758","TLSv1.3","16450","","","","","Application Data"
"80","0.329445","7443","23758","TLSv1.3","16450","","","","","Application Data"
"81","0.329453","7443","23758","TLSv1.3","16450","","","","","Application Data"
"82","0.329463","23758","7443","TCP","44","","","","","23758  >  7443 [ACK] Seq=691 Ack=428386 Win=2521088 Len=0"
"83","0.329572","23758","7443","TCP","44","","","","","[TCP Window Update] 23758  >  7443 [ACK] Seq=691 Ack=428386 Win=2586880 Len=0"
"84","0.329575","7443","23758","TLSv1.3","16450","","","","","Application Data"
"85","0.329584","7443","23758","TLSv1.3","16450","","","","","Application Data"
"86","0.329593","7443","23758","TLSv1.3","16450","","","","","Application Data"
"87","0.329609","7443","23758","TLSv1.3","16450","","","","","Application Data"
"88","0.329621","7443","23758","TLSv1.3","16450","","","","","Application Data"
"89","0.329636","7443","23758","TLSv1.3","16450","","","","","Application Data"
"90","0.329652","7443","23758","TLSv1.3","16450","","","","","Application Data"
"91","0.329664","7443","23758","TLSv1.3","16450","","","","","Application Data"
"92","0.329678","7443","23758","TLSv1.3","16450","","","","","Application Data"
"93","0.329690","23758","7443","TCP","44","","","","","23758  >  7443 [ACK] Seq=691 Ack=592446 Win=2422784 Len=0"
"94","0.329693","7443","23758","TLSv1.3","16450","","","","","Application Data"
"95","0.329704","23758","7443","TCP","44","","","","","[TCP Window Update] 23758  >  7443 [ACK] Seq=691 Ack=592446 Win=2488320 Len=0"
"96","0.329707","7443","23758","TLSv1.3","16450","","","","","Application Data"
"97","0.329718","7443","23758","TLSv1.3","16450","","","","","Application Data"
"98","0.329824","7443","23758","TLSv1.3","16450","","","","","Application Data"
"99","0.329834","7443","23758","TLSv1.3","16450","","","","","Application Data"
"100","0.329844","7443","23758","TLSv1.3","16450","","","","","Application Data"
"101","0.329853","23758","7443","TCP","44","","","","","[TCP Window Update] 23758  >  7443 [ACK] Seq=691 Ack=592446 Win=2554112 Len=0"
"102","0.329856","7443","23758","TLSv1.3","16450","","","","","Application Data"
"103","0.329864","7443","23758","TLSv1.3","16450","","","","","Application Data"
"104","0.329873","7443","23758","TLSv1.3","16450","","","","","Application Data"
"105","0.329881","7443","23758","TLSv1.3","16450","","","","","Application Data"
"106","0.329896","7443","23758","TLSv1.3","16450","","","","","Application Data"
"107","0.329913","7443","23758","TLSv1.3","16450","","","","","Application Data"
"108","0.329930","7443","23758","TLSv1.3","16450","","","","","Application Data"
"109","0.329942","7443","23758","TLSv1.3","16450","","","","","Application Data"
"110","0.329956","7443","23758","TLSv1.3","16450","","","","","Application Data"
"111","0.329969","7443","23758","TLSv1.3","16450","","","","","Application Data"
"112","0.329991","23758","7443","TCP","44","","","","","23758  >  7443 [ACK] Seq=691 Ack=789318 Win=2357248 Len=0"
"113","0.329995","7443","23758","TLSv1.3","16450","","","","","Application Data"
"114","0.330165","7443","23758","TLSv1.3","16450","","","","","Application Data"
"115","0.330175","7443","23758","TLSv1.3","16450","","","","","Application Data"
"116","0.330184","23758","7443","TCP","44","","","","","23758  >  7443 [ACK] Seq=691 Ack=1019002 Win=2127616 Len=0"
"117","0.330228","23758","7443","TCP","44","","","","","23758  >  7443 [ACK] Seq=691 Ack=1051814 Win=2094848 Len=0"
"118","0.343215","23758","7443","TCP","44","","","","","[TCP Window Update] 23758  >  7443 [ACK] Seq=691 Ack=1051814 Win=2163712 Len=0"
"119","0.347591","23758","7443","TCP","44","","","","","[TCP Window Update] 23758  >  7443 [ACK] Seq=691 Ack=1051814 Win=2229248 Len=0"
"120","0.357071","23758","7443","TCP","44","","","","","[TCP Window Update] 23758  >  7443 [ACK] Seq=691 Ack=1051814 Win=2295040 Len=0"
"121","0.360523","23758","7443","TCP","44","","","","","[TCP Window Update] 23758  >  7443 [ACK] Seq=691 Ack=1051814 Win=2360576 Len=0"
"122","0.369585","23758","7443","TCP","44","","","","","[TCP Window Update] 23758  >  7443 [ACK] Seq=691 Ack=1051814 Win=2426112 Len=0"
"123","0.373053","23758","7443","TCP","44","","","","","[TCP Window Update] 23758  >  7443 [ACK] Seq=691 Ack=1051814 Win=2491904 Len=0"
"124","0.376627","23758","7443","TCP","44","","","","","[TCP Window Update] 23758  >  7443 [ACK] Seq=691 Ack=1051814 Win=2557440 Len=0"
"125","0.427157","23758","7443","TLSv1.3","68","","","","","Application Data"
"126","0.427185","7443","23758","TCP","44","","","","","7443  >  23758 [ACK] Seq=1051814 Ack=715 Win=2619392 Len=0"
"127","0.427261","23758","7443","TCP","44","","","","","23758  >  7443 [FIN, ACK] Seq=715 Ack=1051814 Win=2557440 Len=0"
"128","0.427275","7443","23758","TCP","44","","","","","7443  >  23758 [ACK] Seq=1051814 Ack=716 Win=2619392 Len=0"
"129","0.427310","7443","23758","TLSv1.3","68","","","","","Application Data"
"130","0.427337","23758","7443","TCP","44","","","","","23758  >  7443 [ACK] Seq=716 Ack=1051838 Win=2557440 Len=0"
"131","0.427381","7443","23758","TCP","44","","","","","7443  >  23758 [FIN, ACK] Seq=1051838 Ack=716 Win=2619392 Len=0"
"132","0.427402","23758","7443","TCP","44","","","","","23758  >  7443 [RST, ACK] Seq=716 Ack=1051838 Win=0 Len=0"
"133","0.427409","23758","7443","TCP","44","","","","","23758  >  7443 [RST] Seq=716 Win=0 Len=0"
"134","0.449148","23760","7443","TCP","56","","","","","23760  >  7443 [SYN] Seq=0 Win=65535 Len=0 MSS=65495 WS=256 SACK_PERM=1"
"135","0.449256","7443","23760","TCP","56","","","","","7443  >  23760 [SYN, ACK] Seq=0 Ack=1 Win=65535 Len=0 MSS=65495 WS=256 SACK_PERM=1"
"136","0.449334","23760","7443","TCP","44","","","","","23760  >  7443 [ACK] Seq=1 Ack=1 Win=2619648 Len=0"
"137","0.660808","23760","7443","TLSv1.3","561","","","","","Client Hello"
"138","0.660837","7443","23760","TCP","44","","","","","7443  >  23760 [ACK] Seq=1 Ack=518 Win=2619648 Len=0"
"139","0.661854","7443","23760","TLSv1.3","1480","","","","","Server Hello, Change Cipher Spec, Application Data, Application Data, Application Data, Application Data, Application Data"
"140","0.661912","23760","7443","TCP","44","","","","","23760  >  7443 [ACK] Seq=518 Ack=1437 Win=2618112 Len=0"
"141","0.688486","23760","7443","TLSv1.3","108","","","","","Change Cipher Spec, Application Data"
"142","0.688559","7443","23760","TCP","44","","","","","7443  >  23760 [ACK] Seq=1437 Ack=582 Win=2619648 Len=0"
"143","0.692088","23760","7443","TLSv1.3","153","","","","","Application Data"
"144","0.692124","7443","23760","TCP","44","","","","","7443  >  23760 [ACK] Seq=1437 Ack=691 Win=2619392 Len=0"
"145","0.692690","7443","23760","TLSv1.3","1252","","","","","Application Data"
"146","0.692729","23760","7443","TCP","44","","","","","23760  >  7443 [ACK] Seq=691 Ack=2645 Win=2617088 Len=0"
"147","0.692767","7443","23760","TLSv1.3","2438","","","","","Application Data"
"148","0.692796","23760","7443","TCP","44","","","","","23760  >  7443 [ACK] Seq=691 Ack=5039 Win=2614528 Len=0"
"149","0.692822","7443","23760","TLSv1.3","604","","","","","Application Data"
"150","0.692843","23760","7443","TCP","44","","","","","23760  >  7443 [ACK] Seq=691 Ack=5599 Win=2614016 Len=0"
"151","0.692881","7443","23760","TLSv1.3","4810","","","","","Application Data"
"152","0.692902","23760","7443","TCP","44","","","","","23760  >  7443 [ACK] Seq=691 Ack=10365 Win=2609408 Len=0"
"153","0.692941","7443","23760","TLSv1.3","5996","","","","","Application Data"
"154","0.692966","23760","7443","TCP","44","","","","","23760  >  7443 [ACK] Seq=691 Ack=16317 Win=2603264 Len=0"
"155","0.692998","7443","23760","TLSv1.3","7182","","","","","Application Data"
"156","0.693019","23760","7443","TCP","44","","","","","23760  >  7443 [ACK] Seq=691 Ack=23455 Win=2596096 Len=0"
"157","0.693040","7443","23760","TLSv1.3","8368","","","","","Application Data"
"158","0.693061","23760","7443","TCP","44","","","","","23760  >  7443 [ACK] Seq=691 Ack=31779 Win=2587904 Len=0"
"159","0.693081","7443","23760","TLSv1.3","2863","","","","","Application Data"
"160","0.693096","23760","7443","TCP","44","","","","","23760  >  7443 [ACK] Seq=691 Ack=34598 Win=2585088 Len=0"
"161","0.693320","7443","23760","TLSv1.3","10740","","","","","Application Data"
"162","0.693350","23760","7443","TCP","44","","","","","23760  >  7443 [ACK] Seq=691 Ack=45294 Win=2574336 Len=0"
"163","0.693385","7443","23760","TLSv1.3","11926","","","","","Application Data"
"164","0.693410","23760","7443","TCP","44","","","","","23760  >  7443 [ACK] Seq=691 Ack=57176 Win=2562560 Len=0"
"165","0.693436","7443","23760","TLSv1.3","10300","","","","","Application Data"
"166","0.693461","23760","7443","TCP","44","","","","","23760  >  7443 [ACK] Seq=691 Ack=67432 Win=2552320 Len=0"
"167","0.693516","23760","7443","TCP","44","","","","","[TCP Window Update] 23760  >  7443 [ACK] Seq=691 Ack=67432 Win=2619648 Len=0"
"168","0.693574","7443","23760","TLSv1.3","14298","","","","","Application Data"
"169","0.693603","23760","7443","TCP","44","","","","","23760  >  7443 [ACK] Seq=691 Ack=81686 Win=2605312 Len=0"
"170","0.693631","7443","23760","TLSv1.3","15484","","","","","Application Data"
"171","0.693664","23760","7443","TCP","44","","","","","23760  >  7443 [ACK] Seq=691 Ack=97126 Win=2589952 Len=0"
"172","0.693685","7443","23760","TLSv1.3","3184","","","","","Application Data"
"173","0.693707","23760","7443","TCP","44","","","","","23760  >  7443 [ACK] Seq=691 Ack=100266 Win=2586880 Len=0"
"174","0.693884","7443","23760","TLSv1.3","16450","","","","","Application Data"
"175","0.693931","23760","7443","TCP","44","","","","","23760  >  7443 [ACK] Seq=691 Ack=116672 Win=2570496 Len=0"
"176","0.694042","7443","23760","TLSv1.3","16450","","","","","Application Data"
"177","0.694083","23760","7443","TCP","44","","","","","23760  >  7443 [ACK] Seq=691 Ack=133078 Win=2554112 Len=0"
"178","0.694103","23760","7443","TCP","44","","","","","[TCP Window Update] 23760  >  7443 [ACK] Seq=691 Ack=133078 Win=2619648 Len=0"
"179","0.694195","7443","23760","TLSv1.3","16450","","","","","Application Data"
"180","0.694240","23760","7443","TCP","44","","","","","23760  >  7443 [ACK] Seq=691 Ack=149484 Win=2603264 Len=0"
"181","0.694275","7443","23760","TLSv1.3","16450","","","","","Application Data"
"182","0.694310","23760","7443","TCP","44","","","","","23760  >  7443 [ACK] Seq=691 Ack=165890 Win=2586880 Len=0"
"183","0.694404","7443","23760","TLSv1.3","16450","","","","","Application Data"
"184","0.694446","23760","7443","TCP","44","","","","","23760  >  7443 [ACK] Seq=691 Ack=182296 Win=2570496 Len=0"
"185","0.694532","7443","23760","TLSv1.3","16450","","","","","Application Data"
"186","0.694569","23760","7443","TCP","44","","","","","23760  >  7443 [ACK] Seq=691 Ack=198702 Win=2554112 Len=0"
"187","0.694589","23760","7443","TCP","44","","","","","[TCP Window Update] 23760  >  7443 [ACK] Seq=691 Ack=198702 Win=2619648 Len=0"
"188","0.694660","7443","23760","TLSv1.3","16450","","","","","Application Data"
"189","0.694706","23760","7443","TCP","44","","","","","23760  >  7443 [ACK] Seq=691 Ack=215108 Win=2603264 Len=0"
"190","0.694872","7443","23760","TLSv1.3","16450","","","","","Application Data"
"191","0.694910","23760","7443","TCP","44","","","","","23760  >  7443 [ACK] Seq=691 Ack=231514 Win=2586880 Len=0"
"192","0.694970","7443","23760","TLSv1.3","16450","","","","","Application Data"
"193","0.695001","23760","7443","TCP","44","","","","","23760  >  7443 [ACK] Seq=691 Ack=247920 Win=2570496 Len=0"
"194","0.695026","7443","23760","TLSv1.3","16450","","","","","Application Data"
"195","0.695054","23760","7443","TCP","44","","","","","23760  >  7443 [ACK] Seq=691 Ack=264326 Win=2554112 Len=0"
"196","0.695082","23760","7443","TCP","44","","","","","[TCP Window Update] 23760  >  7443 [ACK] Seq=691 Ack=264326 Win=2619648 Len=0"
"197","0.695102","7443","23760","TLSv1.3","16450","","","","","Application Data"
"198","0.695132","23760","7443","TCP","44","","","","","23760  >  7443 [ACK] Seq=691 Ack=280732 Win=2603264 Len=0"
"199","0.695159","7443","23760","TLSv1.3","16450","","","","","Application Data"
"200","0.695197","23760","7443","TCP","44","","","","","23760  >  7443 [ACK] Seq=691 Ack=297138 Win=2586880 Len=0"
"201","0.695268","7443","23760","TLSv1.3","16450","","","","","Application Data"
"202","0.695313","23760","7443","TCP","44","","","","","23760  >  7443 [ACK] Seq=691 Ack=313544 Win=2570496 Len=0"
"203","0.695355","7443","23760","TLSv1.3","16450","","","","","Application Data"
"204","0.695379","23760","7443","TCP","44","","","","","23760  >  7443 [ACK] Seq=691 Ack=329950 Win=2554112 Len=0"
"205","0.695407","23760","7443","TCP","44","","","","","[TCP Window Update] 23760  >  7443 [ACK] Seq=691 Ack=329950 Win=2619648 Len=0"
"206","0.695423","7443","23760","TLSv1.3","16450","","","","","Application Data"
"207","0.695495","7443","23760","TLSv1.3","16450","","","","","Application Data"
"208","0.695525","23760","7443","TCP","44","","","","","23760  >  7443 [ACK] Seq=691 Ack=346356 Win=2603264 Len=0"
"209","0.695558","7443","23760","TLSv1.3","16450","","","","","Application Data"
"210","0.695577","7443","23760","TLSv1.3","16450","","","","","Application Data"
"211","0.695603","23760","7443","TCP","44","","","","","23760  >  7443 [ACK] Seq=691 Ack=362762 Win=2586880 Len=0"
"212","0.695643","7443","23760","TLSv1.3","16450","","","","","Application Data"
"213","0.695664","7443","23760","TLSv1.3","16450","","","","","Application Data"
"214","0.695680","23760","7443","TCP","44","","","","","23760  >  7443 [ACK] Seq=691 Ack=395574 Win=2554112 Len=0"
"215","0.695708","23760","7443","TCP","44","","","","","[TCP Window Update] 23760  >  7443 [ACK] Seq=691 Ack=395574 Win=2619648 Len=0"
"216","0.695712","23760","7443","TCP","44","","","","","23760  >  7443 [ACK] Seq=691 Ack=428386 Win=2586880 Len=0"
"217","0.695797","7443","23760","TLSv1.3","16450","","","","","Application Data"
"218","0.695832","23760","7443","TCP","44","","","","","23760  >  7443 [ACK] Seq=691 Ack=444792 Win=2570496 Len=0"
"219","0.695860","7443","23760","TLSv1.3","16450","","","","","Application Data"
"220","0.695888","23760","7443","TCP","44","","","","","23760  >  7443 [ACK] Seq=691 Ack=461198 Win=2554112 Len=0"
"221","0.695913","23760","7443","TCP","44","","","","","[TCP Window Update] 23760  >  7443 [ACK] Seq=691 Ack=461198 Win=2619648 Len=0"
"222","0.695985","7443","23760","TLSv1.3","16450","","","","","Application Data"
"223","0.696028","23760","7443","TCP","44","","","","","23760  >  7443 [ACK] Seq=691 Ack=477604 Win=2603264 Len=0"
"224","0.696189","7443","23760","TLSv1.3","16450","","","","","Application Data"
"225","0.696229","23760","7443","TCP","44","","","","","23760  >  7443 [ACK] Seq=691 Ack=494010 Win=2586880 Len=0"
"226","0.696294","7443","23760","TLSv1.3","16450","","","","","Application Data"
"227","0.696326","23760","7443","TCP","44","","","","","23760  >  7443 [ACK] Seq=691 Ack=510416 Win=2570496 Len=0"
"228","0.696354","7443","23760","TLSv1.3","16450","","","","","Application Data"
"229","0.696382","23760","7443","TCP","44","","","","","23760  >  7443 [ACK] Seq=691 Ack=526822 Win=2554112 Len=0"
"230","0.696432","7443","23760","TLSv1.3","16450","","","","","Application Data"
"231","0.696465","23760","7443","TCP","44","","","","","23760  >  7443 [ACK] Seq=691 Ack=543228 Win=2537728 Len=0"
"232","0.696500","7443","23760","TLSv1.3","16450","","","","","Application Data"
"233","0.696535","23760","7443","TCP","44","","","","","23760  >  7443 [ACK] Seq=691 Ack=559634 Win=2521088 Len=0"
"234","0.696579","7443","23760","TLSv1.3","16450","","","","","Application Data"
"235","0.696619","23760","7443","TCP","44","","","","","23760  >  7443 [ACK] Seq=691 Ack=576040 Win=2504704 Len=0"
"236","0.696648","7443","23760","TLSv1.3","16450","","","","","Application Data"
"237","0.696677","23760","7443","TCP","44","","","","","23760  >  7443 [ACK] Seq=691 Ack=592446 Win=2488320 Len=0"
"238","0.696719","7443","23760","TLSv1.3","16450","","","","","Application Data"
"239","0.696749","23760","7443","TCP","44","","","","","23760  >  7443 [ACK] Seq=691 Ack=608852 Win=2471936 Len=0"
"240","0.696780","7443","23760","TLSv1.3","16450","","","","","Application Data"
"241","0.696810","23760","7443","TCP","44","","","","","23760  >  7443 [ACK] Seq=691 Ack=625258 Win=2455552 Len=0"
"242","0.696849","7443","23760","TLSv1.3","16450","","","","","Application Data"
"243","0.696878","23760","7443","TCP","44","","","","","23760  >  7443 [ACK] Seq=691 Ack=641664 Win=2439168 Len=0"
"244","0.696903","7443","23760","TLSv1.3","16450","","","","","Application Data"
"245","0.696938","23760","7443","TCP","44","","","","","23760  >  7443 [ACK] Seq=691 Ack=658070 Win=2422784 Len=0"
"246","0.696978","7443","23760","TLSv1.3","16450","","","","","Application Data"
"247","0.697007","23760","7443","TCP","44","","","","","23760  >  7443 [ACK] Seq=691 Ack=674476 Win=2406400 Len=0"
"248","0.697033","7443","23760","TLSv1.3","16450","","","","","Application Data"
"249","0.697071","23760","7443","TCP","44","","","","","23760  >  7443 [ACK] Seq=691 Ack=690882 Win=2390016 Len=0"
"250","0.697117","7443","23760","TLSv1.3","16450","","","","","Application Data"
"251","0.697148","23760","7443","TCP","44","","","","","23760  >  7443 [ACK] Seq=691 Ack=707288 Win=2373632 Len=0"
"252","0.697173","7443","23760","TLSv1.3","16450","","","","","Application Data"
"253","0.697203","23760","7443","TCP","44","","","","","23760  >  7443 [ACK] Seq=691 Ack=723694 Win=2357248 Len=0"
"254","0.697252","7443","23760","TLSv1.3","16450","","","","","Application Data"
"255","0.697287","23760","7443","TCP","44","","","","","23760  >  7443 [ACK] Seq=691 Ack=740100 Win=2340864 Len=0"
"256","0.697318","7443","23760","TLSv1.3","16450","","","","","Application Data"
"257","0.697355","23760","7443","TCP","44","","","","","23760  >  7443 [ACK] Seq=691 Ack=756506 Win=2324224 Len=0"
"258","0.697405","7443","23760","TLSv1.3","16450","","","","","Application Data"
"259","0.697441","23760","7443","TCP","44","","","","","23760  >  7443 [ACK] Seq=691 Ack=772912 Win=2307840 Len=0"
"260","0.697471","7443","23760","TLSv1.3","16450","","","","","Application Data"
"261","0.697508","23760","7443","TCP","44","","","","","23760  >  7443 [ACK] Seq=691 Ack=789318 Win=2291456 Len=0"
"262","0.697558","7443","23760","TLSv1.3","16450","","","","","Application Data"
"263","0.697591","23760","7443","TCP","44","","","","","23760  >  7443 [ACK] Seq=691 Ack=805724 Win=2275072 Len=0"
"264","0.697631","7443","23760","TLSv1.3","16450","","","","","Application Data"
"265","0.697678","23760","7443","TCP","44","","","","","23760  >  7443 [ACK] Seq=691 Ack=822130 Win=2258688 Len=0"
"266","0.697739","7443","23760","TLSv1.3","16450","","","","","Application Data"
"267","0.697783","23760","7443","TCP","44","","","","","23760  >  7443 [ACK] Seq=691 Ack=838536 Win=2242304 Len=0"
"268","0.697820","7443","23760","TLSv1.3","16450","","","","","Application Data"
"269","0.697862","23760","7443","TCP","44","","","","","23760  >  7443 [ACK] Seq=691 Ack=854942 Win=2225920 Len=0"
"270","0.697949","7443","23760","TLSv1.3","16450","","","","","Application Data"
"271","0.697996","23760","7443","TCP","44","","","","","23760  >  7443 [ACK] Seq=691 Ack=871348 Win=2209536 Len=0"
"272","0.698044","7443","23760","TLSv1.3","16450","","","","","Application Data"
"273","0.698099","23760","7443","TCP","44","","","","","23760  >  7443 [ACK] Seq=691 Ack=887754 Win=2193152 Len=0"
"274","0.698178","7443","23760","TLSv1.3","16450","","","","","Application Data"
"275","0.698241","23760","7443","TCP","44","","","","","23760  >  7443 [ACK] Seq=691 Ack=904160 Win=2176768 Len=0"
"276","0.698292","7443","23760","TLSv1.3","16450","","","","","Application Data"
"277","0.698326","23760","7443","TCP","44","","","","","23760  >  7443 [ACK] Seq=691 Ack=920566 Win=2160384 Len=0"
"278","0.698388","7443","23760","TLSv1.3","16450","","","","","Application Data"
"279","0.698420","23760","7443","TCP","44","","","","","23760  >  7443 [ACK] Seq=691 Ack=936972 Win=2144000 Len=0"
"280","0.698442","7443","23760","TLSv1.3","16450","","","","","Application Data"
"281","0.698474","23760","7443","TCP","44","","","","","23760  >  7443 [ACK] Seq=691 Ack=953378 Win=2127360 Len=0"
"282","0.698540","7443","23760","TLSv1.3","16450","","","","","Application Data"
"283","0.698571","23760","7443","TCP","44","","","","","23760  >  7443 [ACK] Seq=691 Ack=969784 Win=2110976 Len=0"
"284","0.698593","7443","23760","TLSv1.3","16450","","","","","Application Data"
"285","0.698618","23760","7443","TCP","44","","","","","23760  >  7443 [ACK] Seq=691 Ack=986190 Win=2094592 Len=0"
"286","0.698666","7443","23760","TLSv1.3","16450","","","","","Application Data"
"287","0.698698","23760","7443","TCP","44","","","","","23760  >  7443 [ACK] Seq=691 Ack=1002596 Win=2078208 Len=0"
"288","0.698721","7443","23760","TLSv1.3","16450","","","","","Application Data"
"289","0.698750","23760","7443","TCP","44","","","","","23760  >  7443 [ACK] Seq=691 Ack=1019002 Win=2061824 Len=0"
"290","0.698794","7443","23760","TLSv1.3","16450","","","","","Application Data"
"291","0.698823","23760","7443","TCP","44","","","","","23760  >  7443 [ACK] Seq=691 Ack=1035408 Win=2045440 Len=0"
"292","0.698859","7443","23760","TLSv1.3","16450","","","","","Application Data"
"293","0.698890","23760","7443","TCP","44","","","","","23760  >  7443 [ACK] Seq=691 Ack=1051814 Win=2029056 Len=0"
"294","0.703828","23760","7443","TCP","44","","","","","[TCP Window Update] 23760  >  7443 [ACK] Seq=691 Ack=1051814 Win=2094848 Len=0"
"295","0.723606","23760","7443","TCP","44","","","","","[TCP Window Update] 23760  >  7443 [ACK] Seq=691 Ack=1051814 Win=2163712 Len=0"
"296","0.728118","23760","7443","TCP","44","","","","","[TCP Window Update] 23760  >  7443 [ACK] Seq=691 Ack=1051814 Win=2229248 Len=0"
"297","0.731543","23760","7443","TCP","44","","","","","[TCP Window Update] 23760  >  7443 [ACK] Seq=691 Ack=1051814 Win=2295040 Len=0"
"298","0.742619","23760","7443","TCP","44","","","","","[TCP Window Update] 23760  >  7443 [ACK] Seq=691 Ack=1051814 Win=2360576 Len=0"
"299","0.746907","23760","7443","TCP","44","","","","","[TCP Window Update] 23760  >  7443 [ACK] Seq=691 Ack=1051814 Win=2426112 Len=0"
"300","0.753927","23760","7443","TCP","44","","","","","[TCP Window Update] 23760  >  7443 [ACK] Seq=691 Ack=1051814 Win=2491904 Len=0"
"301","0.757807","23760","7443","TCP","44","","","","","[TCP Window Update] 23760  >  7443 [ACK] Seq=691 Ack=1051814 Win=2557440 Len=0"
"302","0.801805","23760","7443","TLSv1.3","68","","","","","Application Data"
"303","0.801833","7443","23760","TCP","44","","","","","7443  >  23760 [ACK] Seq=1051814 Ack=715 Win=2619392 Len=0"
"304","0.801908","23760","7443","TCP","44","","","","","23760  >  7443 [FIN, ACK] Seq=715 Ack=1051814 Win=2557440 Len=0"
"305","0.801921","7443","23760","TCP","44","","","","","7443  >  23760 [ACK] Seq=1051814 Ack=716 Win=2619392 Len=0"
"306","0.801944","7443","23760","TLSv1.3","68","","","","","Application Data"
"307","0.801967","23760","7443","TCP","44","","","","","23760  >  7443 [ACK] Seq=716 Ack=1051838 Win=2557440 Len=0"
"308","0.801994","7443","23760","TCP","44","","","","","7443  >  23760 [FIN, ACK] Seq=1051838 Ack=716 Win=2619392 Len=0"
"309","0.802007","23760","7443","TCP","44","","","","","23760  >  7443 [RST] Seq=716 Win=0 Len=0"
"310","0.802018","23760","7443","TCP","44","","","","","23760  >  7443 [RST, ACK] Seq=716 Ack=1051838 Win=0 Len=0"
"311","0.825816","23761","7443","TCP","56","","","","","23761  >  7443 [SYN] Seq=0 Win=65535 Len=0 MSS=65495 WS=256 SACK_PERM=1"
"312","0.825906","7443","23761","TCP","56","","","","","7443  >  23761 [SYN, ACK] Seq=0 Ack=1 Win=65535 Len=0 MSS=65495 WS=256 SACK_PERM=1"
"313","0.826005","23761","7443","TCP","44","","","","","23761  >  7443 [ACK] Seq=1 Ack=1 Win=2619648 Len=0"
"314","1.031876","23761","7443","TLSv1.3","561","","","","","Client Hello"
"315","1.031905","7443","23761","TCP","44","","","","","7443  >  23761 [ACK] Seq=1 Ack=518 Win=2619648 Len=0"
"316","1.032372","7443","23761","TLSv1.3","1480","","","","","Server Hello, Change Cipher Spec, Application Data, Application Data, Application Data, Application Data, Application Data"
"317","1.032394","23761","7443","TCP","44","","","","","23761  >  7443 [ACK] Seq=518 Ack=1437 Win=2618112 Len=0"
"318","1.058603","23761","7443","TLSv1.3","108","","","","","Change Cipher Spec, Application Data"
"319","1.058631","7443","23761","TCP","44","","","","","7443  >  23761 [ACK] Seq=1437 Ack=582 Win=2619648 Len=0"
"320","1.061130","23761","7443","TLSv1.3","153","","","","","Application Data"
"321","1.061152","7443","23761","TCP","44","","","","","7443  >  23761 [ACK] Seq=1437 Ack=691 Win=2619392 Len=0"
"322","1.061533","7443","23761","TLSv1.3","1252","","","","","Application Data"
"323","1.061558","23761","7443","TCP","44","","","","","23761  >  7443 [ACK] Seq=691 Ack=2645 Win=2617088 Len=0"
"324","1.061580","7443","23761","TLSv1.3","2438","","","","","Application Data"
"325","1.061594","23761","7443","TCP","44","","","","","23761  >  7443 [ACK] Seq=691 Ack=5039 Win=2614528 Len=0"
"326","1.061608","7443","23761","TLSv1.3","604","","","","","Application Data"
"327","1.061621","23761","7443","TCP","44","","","","","23761  >  7443 [ACK] Seq=691 Ack=5599 Win=2614016 Len=0"
"328","1.061639","7443","23761","TLSv1.3","4810","","","","","Application Data"
"329","1.061654","23761","7443","TCP","44","","","","","23761  >  7443 [ACK] Seq=691 Ack=10365 Win=2609408 Len=0"
"330","1.061672","7443","23761","TLSv1.3","5996","","","","","Application Data"
"331","1.061691","23761","7443","TCP","44","","","","","23761  >  7443 [ACK] Seq=691 Ack=16317 Win=2603264 Len=0"
"332","1.061715","7443","23761","TLSv1.3","7182","","","","","Application Data"
"333","1.061732","23761","7443","TCP","44","","","","","23761  >  7443 [ACK] Seq=691 Ack=23455 Win=2596096 Len=0"
"334","1.061747","7443","23761","TLSv1.3","8368","","","","","Application Data"
"335","1.061762","23761","7443","TCP","44","","","","","23761  >  7443 [ACK] Seq=691 Ack=31779 Win=2587904 Len=0"
"336","1.061775","7443","23761","TLSv1.3","2863","","","","","Application Data"
"337","1.061788","23761","7443","TCP","44","","","","","23761  >  7443 [ACK] Seq=691 Ack=34598 Win=2585088 Len=0"
"338","1.061825","7443","23761","TLSv1.3","10740","","","","","Application Data"
"339","1.061844","23761","7443","TCP","44","","","","","23761  >  7443 [ACK] Seq=691 Ack=45294 Win=2574336 Len=0"
"340","1.061861","7443","23761","TLSv1.3","11926","","","","","Application Data"
"341","1.061880","23761","7443","TCP","44","","","","","23761  >  7443 [ACK] Seq=691 Ack=57176 Win=2562560 Len=0"
"342","1.061895","7443","23761","TLSv1.3","10300","","","","","Application Data"
"343","1.061912","23761","7443","TCP","44","","","","","23761  >  7443 [ACK] Seq=691 Ack=67432 Win=2552320 Len=0"
"344","1.061941","23761","7443","TCP","44","","","","","[TCP Window Update] 23761  >  7443 [ACK] Seq=691 Ack=67432 Win=2619648 Len=0"
"345","1.061953","7443","23761","TLSv1.3","14298","","","","","Application Data"
"346","1.062004","7443","23761","TLSv1.3","15484","","","","","Application Data"
"347","1.062021","7443","23761","TLSv1.3","3184","","","","","Application Data"
"348","1.062031","23761","7443","TCP","44","","","","","23761  >  7443 [ACK] Seq=691 Ack=81686 Win=2605312 Len=0"
"349","1.062037","7443","23761","TLSv1.3","16450","","","","","Application Data"
"350","1.062084","7443","23761","TLSv1.3","16450","","","","","Application Data"
"351","1.062094","7443","23761","TLSv1.3","16450","","","","","Application Data"
"352","1.062104","23761","7443","TCP","44","","","","","23761  >  7443 [ACK] Seq=691 Ack=100266 Win=2586880 Len=0"
"353","1.062126","7443","23761","TLSv1.3","16450","","","","","Application Data"
"354","1.062137","23761","7443","TCP","44","","","","","23761  >  7443 [ACK] Seq=691 Ack=149484 Win=2537728 Len=0"
"355","1.062145","23761","7443","TCP","44","","","","","[TCP Window Update] 23761  >  7443 [ACK] Seq=691 Ack=149484 Win=2603264 Len=0"
"356","1.062167","7443","23761","TLSv1.3","16450","","","","","Application Data"
"357","1.062207","23761","7443","TCP","44","","","","","23761  >  7443 [ACK] Seq=691 Ack=182296 Win=2570496 Len=0"
"358","1.062240","7443","23761","TLSv1.3","16450","","","","","Application Data"
"359","1.062274","23761","7443","TCP","44","","","","","23761  >  7443 [ACK] Seq=691 Ack=198702 Win=2554112 Len=0"
"360","1.062293","23761","7443","TCP","44","","","","","[TCP Window Update] 23761  >  7443 [ACK] Seq=691 Ack=198702 Win=2619648 Len=0"
"361","1.062331","7443","23761","TLSv1.3","16450","","","","","Application Data"
"362","1.062365","23761","7443","TCP","44","","","","","23761  >  7443 [ACK] Seq=691 Ack=215108 Win=2603264 Len=0"
"363","1.062397","7443","23761","TLSv1.3","16450","","","","","Application Data"
"364","1.062424","23761","7443","TCP","44","","","","","23761  >  7443 [ACK] Seq=691 Ack=231514 Win=2586880 Len=0"
"365","1.062475","7443","23761","TLSv1.3","16450","","","","","Application Data"
"366","1.062509","23761","7443","TCP","44","","","","","23761  >  7443 [ACK] Seq=691 Ack=247920 Win=2570496 Len=0"
"367","1.062537","7443","23761","TLSv1.3","16450","","","","","Application Data"
"368","1.062562","23761","7443","TCP","44","","","","","23761  >  7443 [ACK] Seq=691 Ack=264326 Win=2554112 Len=0"
"369","1.062580","23761","7443","TCP","44","","","","","[TCP Window Update] 23761  >  7443 [ACK] Seq=691 Ack=264326 Win=2619648 Len=0"
"370","1.062613","7443","23761","TLSv1.3","16450","","","","","Application Data"
"371","1.062641","23761","7443","TCP","44","","","","","23761  >  7443 [ACK] Seq=691 Ack=280732 Win=2603264 Len=0"
"372","1.062665","7443","23761","TLSv1.3","16450","","","","","Application Data"
"373","1.062688","23761","7443","TCP","44","","","","","23761  >  7443 [ACK] Seq=691 Ack=297138 Win=2586880 Len=0"
"374","1.062737","7443","23761","TLSv1.3","16450","","","","","Application Data"
"375","1.062761","23761","7443","TCP","44","","","","","23761  >  7443 [ACK] Seq=691 Ack=313544 Win=2570496 Len=0"
"376","1.062781","7443","23761","TLSv1.3","16450","","","","","Application Data"
"377","1.062801","23761","7443","TCP","44","","","","","23761  >  7443 [ACK] Seq=691 Ack=329950 Win=2554112 Len=0"
"378","1.062845","7443","23761","TLSv1.3","16450","","","","","Application Data"
"379","1.062881","23761","7443","TCP","44","","","","","[TCP Window Update] 23761  >  7443 [ACK] Seq=691 Ack=329950 Win=2619648 Len=0"
"380","1.062885","23761","7443","TCP","44","","","","","23761  >  7443 [ACK] Seq=691 Ack=346356 Win=2603264 Len=0"
"381","1.062911","7443","23761","TLSv1.3","16450","","","","","Application Data"
"382","1.062936","23761","7443","TCP","44","","","","","23761  >  7443 [ACK] Seq=691 Ack=362762 Win=2586880 Len=0"
"383","1.062993","7443","23761","TLSv1.3","16450","","","","","Application Data"
"384","1.063017","23761","7443","TCP","44","","","","","23761  >  7443 [ACK] Seq=691 Ack=379168 Win=2570496 Len=0"
"385","1.063048","7443","23761","TLSv1.3","16450","","","","","Application Data"
"386","1.063079","23761","7443","TCP","44","","","","","23761  >  7443 [ACK] Seq=691 Ack=395574 Win=2554112 Len=0"
"387","1.063103","23761","7443","TCP","44","","","","","[TCP Window Update] 23761  >  7443 [ACK] Seq=691 Ack=395574 Win=2619648 Len=0"
"388","1.063124","7443","23761","TLSv1.3","16450","","","","","Application Data"
"389","1.063159","23761","7443","TCP","44","","","","","23761  >  7443 [ACK] Seq=691 Ack=411980 Win=2603264 Len=0"
"390","1.063181","7443","23761","TLSv1.3","16450","","","","","Application Data"
"391","1.063205","23761","7443","TCP","44","","","","","23761  >  7443 [ACK] Seq=691 Ack=428386 Win=2586880 Len=0"
"392","1.063258","7443","23761","TLSv1.3","16450","","","","","Application Data"
"393","1.063299","23761","7443","TCP","44","","","","","23761  >  7443 [ACK] Seq=691 Ack=444792 Win=2570496 Len=0"
"394","1.063344","7443","23761","TLSv1.3","16450","","","","","Application Data"
"395","1.063365","23761","7443","TCP","44","","","","","23761  >  7443 [ACK] Seq=691 Ack=461198 Win=2554112 Len=0"
"396","1.063393","23761","7443","TCP","44","","","","","[TCP Window Update] 23761  >  7443 [ACK] Seq=691 Ack=461198 Win=2619648 Len=0"
"397","1.063407","7443","23761","TLSv1.3","16450","","","","","Application Data"
"398","1.063492","7443","23761","TLSv1.3","16450","","","","","Application Data"
"399","1.063516","23761","7443","TCP","44","","","","","23761  >  7443 [ACK] Seq=691 Ack=477604 Win=2603264 Len=0"
"400","1.063519","7443","23761","TLSv1.3","16450","","","","","Application Data"
"401","1.063559","7443","23761","TLSv1.3","16450","","","","","Application Data"
"402","1.063569","7443","23761","TLSv1.3","16450","","","","","Application Data"
"403","1.063578","7443","23761","TLSv1.3","16450","","","","","Application Data"
"404","1.063587","23761","7443","TCP","44","","","","","23761  >  7443 [ACK] Seq=691 Ack=510416 Win=2570496 Len=0"
"405","1.063591","7443","23761","TLSv1.3","16450","","","","","Application Data"
"406","1.063631","7443","23761","TLSv1.3","16450","","","","","Application Data"
"407","1.063643","7443","23761","TLSv1.3","16450","","","","","Application Data"
"408","1.063656","23761","7443","TCP","44","","","","","23761  >  7443 [ACK] Seq=691 Ack=576040 Win=2504704 Len=0"
"409","1.063659","7443","23761","TLSv1.3","16450","","","","","Application Data"
"410","1.063696","7443","23761","TLSv1.3","16450","","","","","Application Data"
"411","1.063705","7443","23761","TLSv1.3","16450","","","","","Application Data"
"412","1.063715","23761","7443","TCP","44","","","","","23761  >  7443 [ACK] Seq=691 Ack=625258 Win=2455552 Len=0"
"413","1.063725","7443","23761","TLSv1.3","16450","","","","","Application Data"
"414","1.063740","7443","23761","TLSv1.3","16450","","","","","Application Data"
"415","1.063759","7443","23761","TLSv1.3","16450","","","","","Application Data"
"416","1.063768","7443","23761","TLSv1.3","16450","","","","","Application Data"
"417","1.063793","7443","23761","TLSv1.3","16450","","","","","Application Data"
"418","1.063803","23761","7443","TCP","44","","","","","23761  >  7443 [ACK] Seq=691 Ack=723694 Win=2357248 Len=0"
"419","1.063818","7443","23761","TLSv1.3","16450","","","","","Application Data"
"420","1.063830","23761","7443","TCP","44","","","","","23761  >  7443 [ACK] Seq=691 Ack=740100 Win=2340864 Len=0"
"421","1.063844","7443","23761","TLSv1.3","16450","","","","","Application Data"
"422","1.063856","7443","23761","TLSv1.3","16450","","","","","Application Data"
"423","1.063867","23761","7443","TCP","44","","","","","23761  >  7443 [ACK] Seq=691 Ack=756506 Win=2324224 Len=0"
"424","1.063888","7443","23761","TLSv1.3","16450","","","","","Application Data"
"425","1.063898","7443","23761","TLSv1.3","16450","","","","","Application Data"
"426","1.063909","23761","7443","TCP","44","","","","","23761  >  7443 [ACK] Seq=691 Ack=789318 Win=2291456 Len=0"
"427","1.063911","7443","23761","TLSv1.3","16450","","","","","Application Data"
"428","1.063944","7443","23761","TLSv1.3","16450","","","","","Application Data"
"429","1.063955","7443","23761","TLSv1.3","16450","","","","","Application Data"
"430","1.063965","7443","23761","TLSv1.3","16450","","","","","Application Data"
"431","1.063977","23761","7443","TCP","44","","","","","23761  >  7443 [ACK] Seq=691 Ack=838536 Win=2242304 Len=0"
"432","1.064003","7443","23761","TLSv1.3","16450","","","","","Application Data"
"433","1.064012","7443","23761","TLSv1.3","16450","","","","","Application Data"
"434","1.064021","7443","23761","TLSv1.3","16450","","","","","Application Data"
"435","1.064030","7443","23761","TLSv1.3","16450","","","","","Application Data"
"436","1.064040","23761","7443","TCP","44","","","","","23761  >  7443 [ACK] Seq=691 Ack=887754 Win=2193152 Len=0"
"437","1.064071","7443","23761","TLSv1.3","16450","","","","","Application Data"
"438","1.064081","7443","23761","TLSv1.3","16450","","","","","Application Data"
"439","1.064090","7443","23761","TLSv1.3","16450","","","","","Application Data"
"440","1.064100","7443","23761","TLSv1.3","16450","","","","","Application Data"
"441","1.064109","23761","7443","TCP","44","","","","","23761  >  7443 [ACK] Seq=691 Ack=953378 Win=2127360 Len=0"
"442","1.064140","7443","23761","TLSv1.3","16450","","","","","Application Data"
"443","1.064150","7443","23761","TLSv1.3","16450","","","","","Application Data"
"444","1.064159","23761","7443","TCP","44","","","","","23761  >  7443 [ACK] Seq=691 Ack=1019002 Win=2061824 Len=0"
"445","1.064184","23761","7443","TCP","44","","","","","23761  >  7443 [ACK] Seq=691 Ack=1051814 Win=2029056 Len=0"
"446","1.066926","23761","7443","TCP","44","","","","","[TCP Window Update] 23761  >  7443 [ACK] Seq=691 Ack=1051814 Win=2094848 Len=0"
"447","1.095012","23761","7443","TCP","44","","","","","[TCP Window Update] 23761  >  7443 [ACK] Seq=691 Ack=1051814 Win=2163712 Len=0"
"448","1.099816","23761","7443","TCP","44","","","","","[TCP Window Update] 23761  >  7443 [ACK] Seq=691 Ack=1051814 Win=2229248 Len=0"
"449","1.107005","23761","7443","TCP","44","","","","","[TCP Window Update] 23761  >  7443 [ACK] Seq=691 Ack=1051814 Win=2295040 Len=0"
"450","1.110577","23761","7443","TCP","44","","","","","[TCP Window Update] 23761  >  7443 [ACK] Seq=691 Ack=1051814 Win=2360576 Len=0"
"451","1.114345","23761","7443","TCP","44","","","","","[TCP Window Update] 23761  >  7443 [ACK] Seq=691 Ack=1051814 Win=2426112 Len=0"
"452","1.117925","23761","7443","TCP","44","","","","","[TCP Window Update] 23761  >  7443 [ACK] Seq=691 Ack=1051814 Win=2491904 Len=0"
"453","1.128108","23761","7443","TCP","44","","","","","[TCP Window Update] 23761  >  7443 [ACK] Seq=691 Ack=1051814 Win=2557440 Len=0"
"454","1.177692","23761","7443","TLSv1.3","68","","","","","Application Data"
"455","1.177722","7443","23761","TCP","44","","","","","7443  >  23761 [ACK] Seq=1051814 Ack=715 Win=2619392 Len=0"
"456","1.177822","7443","23761","TLSv1.3","68","","","","","Application Data"
"457","1.177845","23761","7443","TCP","44","","","","","23761  >  7443 [FIN, ACK] Seq=715 Ack=1051814 Win=2557440 Len=0"
"458","1.177849","23761","7443","TCP","44","","","","","23761  >  7443 [ACK] Seq=716 Ack=1051838 Win=2557440 Len=0"
"459","1.177868","7443","23761","TCP","44","","","","","7443  >  23761 [ACK] Seq=1051838 Ack=716 Win=2619392 Len=0"
"460","1.177883","23761","7443","TCP","44","","","","","23761  >  7443 [RST, ACK] Seq=716 Ack=1051838 Win=0 Len=0"
"461","1.177887","23761","7443","TCP","44","","","","","23761  >  7443 [RST] Seq=716 Win=0 Len=0"
