"No.","Time","Source","Destination","Protocol","Length","Packet Type","Header Form","Connection Number","Stream index","Info"
"1","0.000000","24231","7443","TCP","56","","","","","24231  >  7443 [SYN] Seq=0 Win=65535 Len=0 MSS=65495 WS=256 SACK_PERM=1"
"2","0.000055","7443","24231","TCP","56","","","","","7443  >  24231 [SYN, ACK] Seq=0 Ack=1 Win=65535 Len=0 MSS=65495 WS=256 SACK_PERM=1"
"3","0.000164","24231","7443","TCP","44","","","","","24231  >  7443 [ACK] Seq=1 Ack=1 Win=2619648 Len=0"
"4","0.209778","24231","7443","TLSv1.3","561","","","","","Client Hello"
"5","0.209807","7443","24231","TCP","44","","","","","7443  >  24231 [ACK] Seq=1 Ack=518 Win=2619648 Len=0"
"6","0.210452","7443","24231","TLSv1.3","1480","","","","","Server Hello, Change Cipher Spec, Application Data, Application Data, Application Data, Application Data, Application Data"
"7","0.210482","24231","7443","TCP","44","","","","","24231  >  7443 [ACK] Seq=518 Ack=1437 Win=2618112 Len=0"
"8","0.232916","24231","7443","TLSv1.3","108","","","","","Change Cipher Spec, Application Data"
"9","0.232943","7443","24231","TCP","44","","","","","7443  >  24231 [ACK] Seq=1437 Ack=582 Win=2619648 Len=0"
"10","0.235311","24231","7443","TLSv1.3","153","","","","","Application Data"
"11","0.235328","7443","24231","TCP","44","","","","","7443  >  24231 [ACK] Seq=1437 Ack=691 Win=2619392 Len=0"
"12","0.301252","7443","24231","TLSv1.3","1252","","","","","Application Data"
"13","0.301288","24231","7443","TCP","44","","","","","24231  >  7443 [ACK] Seq=691 Ack=2645 Win=2617088 Len=0"
"14","0.301340","7443","24231","TLSv1.3","2438","","","","","Application Data"
"15","0.301355","24231","7443","TCP","44","","","","","24231  >  7443 [ACK] Seq=691 Ack=5039 Win=2614528 Len=0"
"16","0.301370","7443","24231","TLSv1.3","604","","","","","Application Data"
"17","0.301381","24231","7443","TCP","44","","","","","24231  >  7443 [ACK] Seq=691 Ack=5599 Win=2614016 Len=0"
"18","0.301403","7443","24231","TLSv1.3","4810","","","","","Application Data"
"19","0.301420","24231","7443","TCP","44","","","","","24231  >  7443 [ACK] Seq=691 Ack=10365 Win=2609408 Len=0"
"20","0.301449","7443","24231","TLSv1.3","5996","","","","","Application Data"
"21","0.301474","24231","7443","TCP","44","","","","","24231  >  7443 [ACK] Seq=691 Ack=16317 Win=2603264 Len=0"
"22","0.301514","7443","24231","TLSv1.3","7182","","","","","Application Data"
"23","0.301529","24231","7443","TCP","44","","","","","24231  >  7443 [ACK] Seq=691 Ack=23455 Win=2596096 Len=0"
"24","0.301571","7443","24231","TLSv1.3","8368","","","","","Application Data"
"25","0.301592","24231","7443","TCP","44","","","","","24231  >  7443 [ACK] Seq=691 Ack=31779 Win=2587904 Len=0"
"26","0.301612","7443","24231","TLSv1.3","2863","","","","","Application Data"
"27","0.301624","24231","7443","TCP","44","","","","","24231  >  7443 [ACK] Seq=691 Ack=34598 Win=2585088 Len=0"
"28","0.301675","7443","24231","TLSv1.3","10740","","","","","Application Data"
"29","0.301694","24231","7443","TCP","44","","","","","24231  >  7443 [ACK] Seq=691 Ack=45294 Win=2574336 Len=0"
"30","0.301724","7443","24231","TLSv1.3","11926","","","","","Application Data"
"31","0.301742","24231","7443","TCP","44","","","","","24231  >  7443 [ACK] Seq=691 Ack=57176 Win=2562560 Len=0"
"32","0.301766","7443","24231","TLSv1.3","10300","","","","","Application Data"
"33","0.301783","24231","7443","TCP","44","","","","","24231  >  7443 [ACK] Seq=691 Ack=67432 Win=2552320 Len=0"
"34","0.301814","24231","7443","TCP","44","","","","","[TCP Window Update] 24231  >  7443 [ACK] Seq=691 Ack=67432 Win=2619648 Len=0"
"35","0.301865","7443","24231","TLSv1.3","14298","","","","","Application Data"
"36","0.301887","24231","7443","TCP","44","","","","","24231  >  7443 [ACK] Seq=691 Ack=81686 Win=2605312 Len=0"
"37","0.301922","7443","24231","TLSv1.3","15484","","","","","Application Data"
"38","0.301950","24231","7443","TCP","44","","","","","24231  >  7443 [ACK] Seq=691 Ack=97126 Win=2589952 Len=0"
"39","0.301966","7443","24231","TLSv1.3","3184","","","","","Application Data"
"40","0.301982","24231","7443","TCP","44","","","","","24231  >  7443 [ACK] Seq=691 Ack=100266 Win=2586880 Len=0"
"41","0.302022","7443","24231","TLSv1.3","16450","","","","","Application Data"
"42","0.302044","24231","7443","TCP","44","","","","","24231  >  7443 [ACK] Seq=691 Ack=116672 Win=2570496 Len=0"
"43","0.302062","7443","24231","TLSv1.3","16450","","","","","Application Data"
"44","0.302081","24231","7443","TCP","44","","","","","24231  >  7443 [ACK] Seq=691 Ack=133078 Win=2554112 Len=0"
"45","0.302111","7443","24231","TLSv1.3","16450","","","","","Application Data"
"46","0.302132","24231","7443","TCP","44","","","","","24231  >  7443 [ACK] Seq=691 Ack=149484 Win=2537728 Len=0"
"47","0.302159","24231","7443","TCP","44","","","","","[TCP Window Update] 24231  >  7443 [ACK] Seq=691 Ack=149484 Win=2603264 Len=0"
"48","0.302171","7443","24231","TLSv1.3","16450","","","","","Application Data"
"49","0.302212","7443","24231","TLSv1.3","16450","","","","","Application Data"
"50","0.302226","24231","7443","TCP","44","","","","","24231  >  7443 [ACK] Seq=691 Ack=165890 Win=2586880 Len=0"
"51","0.302230","7443","24231","TLSv1.3","16450","","","","","Application Data"
"52","0.302271","7443","24231","TLSv1.3","16450","","","","","Application Data"
"53","0.302284","24231","7443","TCP","44","","","","","24231  >  7443 [ACK] Seq=691 Ack=198702 Win=2554112 Len=0"
"54","0.302303","7443","24231","TLSv1.3","16450","","","","","Application Data"
"55","0.302312","24231","7443","TCP","44","","","","","[TCP Window Update] 24231  >  7443 [ACK] Seq=691 Ack=198702 Win=2619648 Len=0"
"56","0.302314","24231","7443","TCP","44","","","","","24231  >  7443 [ACK] Seq=691 Ack=215108 Win=2603264 Len=0"
"57","0.302331","7443","24231","TLSv1.3","16450","","","","","Application Data"
"58","0.302349","24231","7443","TCP","44","","","","","24231  >  7443 [ACK] Seq=691 Ack=231514 Win=2586880 Len=0"
"59","0.302388","7443","24231","TLSv1.3","16450","","","","","Application Data"
"60","0.302408","7443","24231","TLSv1.3","16450","","","","","Application Data"
"61","0.302418","24231","7443","TCP","44","","","","","24231  >  7443 [ACK] Seq=691 Ack=247920 Win=2570496 Len=0"
"62","0.302442","7443","24231","TLSv1.3","16450","","","","","Application Data"
"63","0.302451","24231","7443","TCP","44","","","","","24231  >  7443 [ACK] Seq=691 Ack=280732 Win=2537472 Len=0"
"64","0.302474","7443","24231","TLSv1.3","16450","","","","","Application Data"
"65","0.302493","24231","7443","TCP","44","","","","","24231  >  7443 [ACK] Seq=691 Ack=297138 Win=2521088 Len=0"
"66","0.302544","24231","7443","TCP","44","","","","","[TCP Window Update] 24231  >  7443 [ACK] Seq=691 Ack=297138 Win=2586880 Len=0"
"67","0.302550","7443","24231","TLSv1.3","16450","","","","","Application Data"
"68","0.302567","24231","7443","TCP","44","","","","","24231  >  7443 [ACK] Seq=691 Ack=313544 Win=2570496 Len=0"
"69","0.302593","7443","24231","TLSv1.3","16450","","","","","Application Data"
"70","0.302605","7443","24231","TLSv1.3","16450","","","","","Application Data"
"71","0.302616","7443","24231","TLSv1.3","16450","","","","","Application Data"
"72","0.302630","24231","7443","TCP","44","","","","","24231  >  7443 [ACK] Seq=691 Ack=329950 Win=2554112 Len=0"
"73","0.302671","7443","24231","TLSv1.3","16450","","","","","Application Data"
"74","0.302684","7443","24231","TLSv1.3","16450","","","","","Application Data"
"75","0.302701","24231","7443","TCP","44","","","","","[TCP Window Update] 24231  >  7443 [ACK] Seq=691 Ack=329950 Win=2619648 Len=0"
"76","0.302707","7443","24231","TLSv1.3","16450","","","","","Application Data"
"77","0.302719","7443","24231","TLSv1.3","16450","","","","","Application Data"
"78","0.302729","24231","7443","TCP","44","","","","","24231  >  7443 [ACK] Seq=691 Ack=379168 Win=2570496 Len=0"
"79","0.302772","7443","24231","TLSv1.3","16450","","","","","Application Data"
"80","0.302791","7443","24231","TLSv1.3","16450","","","","","Application Data"
"81","0.302799","7443","24231","TLSv1.3","16450","","","","","Application Data"
"82","0.302808","7443","24231","TLSv1.3","16450","","","","","Application Data"
"83","0.302817","7443","24231","TLSv1.3","16450","","","","","Application Data"
"84","0.302825","24231","7443","TCP","44","","","","","24231  >  7443 [ACK] Seq=691 Ack=444792 Win=2504704 Len=0"
"85","0.302860","24231","7443","TCP","44","","","","","[TCP Window Update] 24231  >  7443 [ACK] Seq=691 Ack=444792 Win=2570496 Len=0"
"86","0.302863","7443","24231","TLSv1.3","16450","","","","","Application Data"
"87","0.302872","7443","24231","TLSv1.3","16450","","","","","Application Data"
"88","0.302883","7443","24231","TLSv1.3","16450","","","","","Application Data"
"89","0.302900","7443","24231","TLSv1.3","16450","","","","","Application Data"
"90","0.302921","24231","7443","TCP","44","","","","","24231  >  7443 [ACK] Seq=691 Ack=526822 Win=2488320 Len=0"
"91","0.302977","7443","24231","TLSv1.3","16450","","","","","Application Data"
"92","0.302992","24231","7443","TCP","44","","","","","[TCP Window Update] 24231  >  7443 [ACK] Seq=691 Ack=526822 Win=2554112 Len=0"
"93","0.302994","7443","24231","TLSv1.3","16450","","","","","Application Data"
"94","0.303002","7443","24231","TLSv1.3","16450","","","","","Application Data"
"95","0.303010","7443","24231","TLSv1.3","16450","","","","","Application Data"
"96","0.303019","24231","7443","TCP","44","","","","","24231  >  7443 [ACK] Seq=691 Ack=592446 Win=2488320 Len=0"
"97","0.303075","7443","24231","TLSv1.3","16450","","","","","Application Data"
"98","0.303087","7443","24231","TLSv1.3","16450","","","","","Application Data"
"99","0.303104","7443","24231","TLSv1.3","16450","","","","","Application Data"
"100","0.303122","7443","24231","TLSv1.3","16450","","","","","Application Data"
"101","0.303136","7443","24231","TLSv1.3","16450","","","","","Application Data"
"102","0.303153","7443","24231","TLSv1.3","16450","","","","","Application Data"
"103","0.303168","24231","7443","TCP","44","","","","","24231  >  7443 [ACK] Seq=691 Ack=658070 Win=2422784 Len=0"
"104","0.303236","7443","24231","TLSv1.3","16450","","","","","Application Data"
"105","0.303270","7443","24231","TLSv1.3","16450","","","","","Application Data"
"106","0.303282","7443","24231","TLSv1.3","16450","","","","","Application Data"
"107","0.303293","7443","24231","TLSv1.3","16450","","","","","Application Data"
"108","0.303304","7443","24231","TLSv1.3","16450","","","","","Application Data"
"109","0.303315","7443","24231","TLSv1.3","16450","","","","","Application Data"
"110","0.303332","7443","24231","TLSv1.3","16450","","","","","Application Data"
"111","0.303349","7443","24231","TLSv1.3","16450","","","","","Application Data"
"112","0.303365","7443","24231","TLSv1.3","16450","","","","","Application Data"
"113","0.303382","24231","7443","TCP","44","","","","","24231  >  7443 [ACK] Seq=691 Ack=756506 Win=2324224 Len=0"
"114","0.303387","7443","24231","TLSv1.3","16450","","","","","Application Data"
"115","0.303510","7443","24231","TLSv1.3","16450","","","","","Application Data"
"116","0.303519","7443","24231","TLSv1.3","16450","","","","","Application Data"
"117","0.303526","24231","7443","TCP","44","","","","","[TCP Window Update] 24231  >  7443 [ACK] Seq=691 Ack=756506 Win=2390016 Len=0"
"118","0.303529","7443","24231","TLSv1.3","16450","","","","","Application Data"
"119","0.303538","7443","24231","TLSv1.3","16450","","","","","Application Data"
"120","0.303546","7443","24231","TLSv1.3","16450","","","","","Application Data"
"121","0.303555","7443","24231","TLSv1.3","16450","","","","","Application Data"
"122","0.303567","7443","24231","TLSv1.3","16450","","","","","Application Data"
"123","0.303577","7443","24231","TLSv1.3","16450","","","","","Application Data"
"124","0.303587","24231","7443","TCP","44","","","","","24231  >  7443 [ACK] Seq=691 Ack=920566 Win=2225920 Len=0"
"125","0.303690","24231","7443","TCP","44","","","","","24231  >  7443 [ACK] Seq=691 Ack=1051814 Win=2094848 Len=0"
"126","0.316835","24231","7443","TCP","44","","","","","[TCP Window Update] 24231  >  7443 [ACK] Seq=691 Ack=1051814 Win=2163712 Len=0"
"127","0.326556","24231","7443","TCP","44","","","","","[TCP Window Update] 24231  >  7443 [ACK] Seq=691 Ack=1051814 Win=2229248 Len=0"
"128","0.330681","24231","7443","TCP","44","","","","","[TCP Window Update] 24231  >  7443 [ACK] Seq=691 Ack=1051814 Win=2295040 Len=0"
"129","0.334354","24231","7443","TCP","44","","","","","[TCP Window Update] 24231  >  7443 [ACK] Seq=691 Ack=1051814 Win=2360576 Len=0"
"130","0.337832","24231","7443","TCP","44","","","","","[TCP Window Update] 24231  >  7443 [ACK] Seq=691 Ack=1051814 Win=2426112 Len=0"
"131","0.347957","24231","7443","TCP","44","","","","","[TCP Window Update] 24231  >  7443 [ACK] Seq=691 Ack=1051814 Win=2491904 Len=0"
"132","0.351595","24231","7443","TCP","44","","","","","[TCP Window Update] 24231  >  7443 [ACK] Seq=691 Ack=1051814 Win=2557440 Len=0"
"133","0.396647","24231","7443","TLSv1.3","153","","","","","Application Data"
"134","0.396675","7443","24231","TCP","44","","","","","7443  >  24231 [ACK] Seq=1051814 Ack=800 Win=2619392 Len=0"
"135","0.397203","7443","24231","TLSv1.3","4162","","","","","Application Data"
"136","0.397231","24231","7443","TCP","44","","","","","24231  >  7443 [ACK] Seq=800 Ack=1055932 Win=2553344 Len=0"
"137","0.397257","24231","7443","TCP","44","","","","","[TCP Window Update] 24231  >  7443 [ACK] Seq=800 Ack=1055932 Win=2619648 Len=0"
"138","0.397280","7443","24231","TLSv1.3","16450","","","","","Application Data"
"139","0.397306","24231","7443","TCP","44","","","","","24231  >  7443 [ACK] Seq=800 Ack=1072338 Win=2603264 Len=0"
"140","0.397325","7443","24231","TLSv1.3","12571","","","","","Application Data"
"141","0.397344","24231","7443","TCP","44","","","","","24231  >  7443 [ACK] Seq=800 Ack=1084865 Win=2590720 Len=0"
"142","0.397385","7443","24231","TLSv1.3","16450","","","","","Application Data"
"143","0.397409","24231","7443","TCP","44","","","","","24231  >  7443 [ACK] Seq=800 Ack=1101271 Win=2574336 Len=0"
"144","0.397427","7443","24231","TLSv1.3","16450","","","","","Application Data"
"145","0.397448","24231","7443","TCP","44","","","","","24231  >  7443 [ACK] Seq=800 Ack=1117677 Win=2557952 Len=0"
"146","0.397479","7443","24231","TLSv1.3","16450","","","","","Application Data"
"147","0.397502","24231","7443","TCP","44","","","","","24231  >  7443 [ACK] Seq=800 Ack=1134083 Win=2541568 Len=0"
"148","0.397527","24231","7443","TCP","44","","","","","[TCP Window Update] 24231  >  7443 [ACK] Seq=800 Ack=1134083 Win=2607360 Len=0"
"149","0.397539","7443","24231","TLSv1.3","16450","","","","","Application Data"
"150","0.397570","7443","24231","TLSv1.3","16450","","","","","Application Data"
"151","0.397581","7443","24231","TLSv1.3","16450","","","","","Application Data"
"152","0.397589","24231","7443","TCP","44","","","","","24231  >  7443 [ACK] Seq=800 Ack=1150489 Win=2590976 Len=0"
"153","0.397618","7443","24231","TLSv1.3","16450","","","","","Application Data"
"154","0.397628","24231","7443","TCP","44","","","","","24231  >  7443 [ACK] Seq=800 Ack=1183301 Win=2558208 Len=0"
"155","0.397645","7443","24231","TLSv1.3","16450","","","","","Application Data"
"156","0.397656","7443","24231","TLSv1.3","16450","","","","","Application Data"
"157","0.397668","24231","7443","TCP","44","","","","","24231  >  7443 [ACK] Seq=800 Ack=1199707 Win=2541824 Len=0"
"158","0.397693","7443","24231","TLSv1.3","16450","","","","","Application Data"
"159","0.397704","7443","24231","TLSv1.3","16450","","","","","Application Data"
"160","0.397716","24231","7443","TCP","44","","","","","[TCP Window Update] 24231  >  7443 [ACK] Seq=800 Ack=1199707 Win=2607360 Len=0"
"161","0.397718","7443","24231","TLSv1.3","16450","","","","","Application Data"
"162","0.397729","24231","7443","TCP","44","","","","","24231  >  7443 [ACK] Seq=800 Ack=1232519 Win=2574592 Len=0"
"163","0.397760","7443","24231","TLSv1.3","16450","","","","","Application Data"
"164","0.397769","7443","24231","TLSv1.3","16450","","","","","Application Data"
"165","0.397778","7443","24231","TLSv1.3","16450","","","","","Application Data"
"166","0.397787","24231","7443","TCP","44","","","","","24231  >  7443 [ACK] Seq=800 Ack=1281737 Win=2525184 Len=0"
"167","0.397815","7443","24231","TLSv1.3","16450","","","","","Application Data"
"168","0.397825","24231","7443","TCP","44","","","","","[TCP Window Update] 24231  >  7443 [ACK] Seq=800 Ack=1281737 Win=2590976 Len=0"
"169","0.397827","7443","24231","TLSv1.3","16450","","","","","Application Data"
"170","0.397836","7443","24231","TLSv1.3","16450","","","","","Application Data"
"171","0.397845","7443","24231","TLSv1.3","16450","","","","","Application Data"
"172","0.397855","24231","7443","TCP","44","","","","","24231  >  7443 [ACK] Seq=800 Ack=1330955 Win=2541824 Len=0"
"173","0.397905","7443","24231","TLSv1.3","16450","","","","","Application Data"
"174","0.397916","24231","7443","TCP","44","","","","","[TCP Window Update] 24231  >  7443 [ACK] Seq=800 Ack=1330955 Win=2607360 Len=0"
"175","0.397919","7443","24231","TLSv1.3","16450","","","","","Application Data"
"176","0.397929","7443","24231","TLSv1.3","16450","","","","","Application Data"
"177","0.397940","7443","24231","TLSv1.3","16450","","","","","Application Data"
"178","0.397952","7443","24231","TLSv1.3","16450","","","","","Application Data"
"179","0.397969","24231","7443","TCP","44","","","","","24231  >  7443 [ACK] Seq=800 Ack=1396579 Win=2541568 Len=0"
"180","0.398026","7443","24231","TLSv1.3","16450","","","","","Application Data"
"181","0.398035","7443","24231","TLSv1.3","16450","","","","","Application Data"
"182","0.398044","7443","24231","TLSv1.3","16450","","","","","Application Data"
"183","0.398052","24231","7443","TCP","44","","","","","[TCP Window Update] 24231  >  7443 [ACK] Seq=800 Ack=1396579 Win=2607360 Len=0"
"184","0.398055","7443","24231","TLSv1.3","16450","","","","","Application Data"
"185","0.398065","7443","24231","TLSv1.3","16450","","","","","Application Data"
"186","0.398074","7443","24231","TLSv1.3","16450","","","","","Application Data"
"187","0.398082","7443","24231","TLSv1.3","16450","","","","","Application Data"
"188","0.398091","24231","7443","TCP","44","","","","","24231  >  7443 [ACK] Seq=800 Ack=1478609 Win=2525184 Len=0"
"189","0.398144","7443","24231","TLSv1.3","16450","","","","","Application Data"
"190","0.398154","7443","24231","TLSv1.3","16450","","","","","Application Data"
"191","0.398163","24231","7443","TCP","44","","","","","[TCP Window Update] 24231  >  7443 [ACK] Seq=800 Ack=1478609 Win=2590976 Len=0"
"192","0.398165","7443","24231","TLSv1.3","16450","","","","","Application Data"
"193","0.398177","7443","24231","TLSv1.3","16450","","","","","Application Data"
"194","0.398188","7443","24231","TLSv1.3","16450","","","","","Application Data"
"195","0.398199","7443","24231","TLSv1.3","16450","","","","","Application Data"
"196","0.398210","7443","24231","TLSv1.3","16450","","","","","Application Data"
"197","0.398222","24231","7443","TCP","44","","","","","24231  >  7443 [ACK] Seq=800 Ack=1593451 Win=2476032 Len=0"
"198","0.398224","7443","24231","TLSv1.3","16450","","","","","Application Data"
"199","0.398293","7443","24231","TLSv1.3","16450","","","","","Application Data"
"200","0.398302","24231","7443","TCP","44","","","","","[TCP Window Update] 24231  >  7443 [ACK] Seq=800 Ack=1593451 Win=2541568 Len=0"
"201","0.398304","7443","24231","TLSv1.3","16450","","","","","Application Data"
"202","0.398312","7443","24231","TLSv1.3","16450","","","","","Application Data"
"203","0.398320","7443","24231","TLSv1.3","16450","","","","","Application Data"
"204","0.398329","7443","24231","TLSv1.3","16450","","","","","Application Data"
"205","0.398337","7443","24231","TLSv1.3","16450","","","","","Application Data"
"206","0.398347","7443","24231","TLSv1.3","16450","","","","","Application Data"
"207","0.398357","7443","24231","TLSv1.3","16450","","","","","Application Data"
"208","0.398365","7443","24231","TLSv1.3","16450","","","","","Application Data"
"209","0.398374","24231","7443","TCP","44","","","","","24231  >  7443 [ACK] Seq=800 Ack=1724699 Win=2410496 Len=0"
"210","0.398432","7443","24231","TLSv1.3","16450","","","","","Application Data"
"211","0.398441","7443","24231","TLSv1.3","16450","","","","","Application Data"
"212","0.398450","7443","24231","TLSv1.3","16450","","","","","Application Data"
"213","0.398458","7443","24231","TLSv1.3","16450","","","","","Application Data"
"214","0.398470","7443","24231","TLSv1.3","16450","","","","","Application Data"
"215","0.398483","7443","24231","TLSv1.3","16450","","","","","Application Data"
"216","0.398497","7443","24231","TLSv1.3","16450","","","","","Application Data"
"217","0.398508","7443","24231","TLSv1.3","16450","","","","","Application Data"
"218","0.398526","7443","24231","TLSv1.3","16450","","","","","Application Data"
"219","0.398539","24231","7443","TCP","44","","","","","24231  >  7443 [ACK] Seq=800 Ack=1872353 Win=2262784 Len=0"
"220","0.398544","7443","24231","TLSv1.3","16450","","","","","Application Data"
"221","0.398651","7443","24231","TLSv1.3","16450","","","","","Application Data"
"222","0.398663","7443","24231","TLSv1.3","16450","","","","","Application Data"
"223","0.398674","7443","24231","TLSv1.3","16450","","","","","Application Data"
"224","0.398685","7443","24231","TLSv1.3","16450","","","","","Application Data"
"225","0.398697","24231","7443","TCP","44","","","","","24231  >  7443 [ACK] Seq=800 Ack=2036413 Win=2098688 Len=0"
"226","0.398768","24231","7443","TCP","44","","","","","24231  >  7443 [ACK] Seq=800 Ack=2102037 Win=2033152 Len=0"
"227","0.407222","24231","7443","TCP","44","","","","","[TCP Window Update] 24231  >  7443 [ACK] Seq=800 Ack=2102037 Win=2102016 Len=0"
"228","0.411021","24231","7443","TCP","44","","","","","[TCP Window Update] 24231  >  7443 [ACK] Seq=800 Ack=2102037 Win=2167808 Len=0"
"229","0.415117","24231","7443","TCP","44","","","","","[TCP Window Update] 24231  >  7443 [ACK] Seq=800 Ack=2102037 Win=2233344 Len=0"
"230","0.418549","24231","7443","TCP","44","","","","","[TCP Window Update] 24231  >  7443 [ACK] Seq=800 Ack=2102037 Win=2299136 Len=0"
"231","0.428756","24231","7443","TCP","44","","","","","[TCP Window Update] 24231  >  7443 [ACK] Seq=800 Ack=2102037 Win=2364672 Len=0"
"232","0.432617","24231","7443","TCP","44","","","","","[TCP Window Update] 24231  >  7443 [ACK] Seq=800 Ack=2102037 Win=2430208 Len=0"
"233","0.436047","24231","7443","TCP","44","","","","","[TCP Window Update] 24231  >  7443 [ACK] Seq=800 Ack=2102037 Win=2496000 Len=0"
"234","0.439523","24231","7443","TCP","44","","","","","[TCP Window Update] 24231  >  7443 [ACK] Seq=800 Ack=2102037 Win=2561536 Len=0"
"235","0.491072","24231","7443","TLSv1.3","153","","","","","Application Data"
"236","0.491100","7443","24231","TCP","44","","","","","7443  >  24231 [ACK] Seq=2102037 Ack=909 Win=2619392 Len=0"
"237","0.491647","7443","24231","TLSv1.3","4162","","","","","Application Data"
"238","0.491685","24231","7443","TCP","44","","","","","24231  >  7443 [ACK] Seq=909 Ack=2106155 Win=2557440 Len=0"
"239","0.491729","7443","24231","TLSv1.3","16450","","","","","Application Data"
"240","0.491754","24231","7443","TCP","44","","","","","24231  >  7443 [ACK] Seq=909 Ack=2122561 Win=2541056 Len=0"
"241","0.491770","24231","7443","TCP","44","","","","","[TCP Window Update] 24231  >  7443 [ACK] Seq=909 Ack=2122561 Win=2607360 Len=0"
"242","0.491795","7443","24231","TLSv1.3","12571","","","","","Application Data"
"243","0.491833","7443","24231","TLSv1.3","16450","","","","","Application Data"
"244","0.491846","24231","7443","TCP","44","","","","","24231  >  7443 [ACK] Seq=909 Ack=2135088 Win=2594816 Len=0"
"245","0.491848","7443","24231","TLSv1.3","16450","","","","","Application Data"
"246","0.491893","7443","24231","TLSv1.3","16450","","","","","Application Data"
"247","0.491913","7443","24231","TLSv1.3","16450","","","","","Application Data"
"248","0.491923","7443","24231","TLSv1.3","16450","","","","","Application Data"
"249","0.491939","7443","24231","TLSv1.3","16450","","","","","Application Data"
"250","0.491958","24231","7443","TCP","44","","","","","24231  >  7443 [ACK] Seq=909 Ack=2167900 Win=2562048 Len=0"
"251","0.491997","7443","24231","TLSv1.3","16450","","","","","Application Data"
"252","0.492006","7443","24231","TLSv1.3","16450","","","","","Application Data"
"253","0.492015","7443","24231","TLSv1.3","16450","","","","","Application Data"
"254","0.492026","7443","24231","TLSv1.3","16450","","","","","Application Data"
"255","0.492046","7443","24231","TLSv1.3","16450","","","","","Application Data"
"256","0.492063","7443","24231","TLSv1.3","16450","","","","","Application Data"
"257","0.492072","24231","7443","TCP","44","","","","","24231  >  7443 [ACK] Seq=909 Ack=2233524 Win=2496512 Len=0"
"258","0.492121","7443","24231","TLSv1.3","16450","","","","","Application Data"
"259","0.492131","7443","24231","TLSv1.3","16450","","","","","Application Data"
"260","0.492139","24231","7443","TCP","44","","","","","[TCP Window Update] 24231  >  7443 [ACK] Seq=909 Ack=2233524 Win=2562304 Len=0"
"261","0.492142","7443","24231","TLSv1.3","16450","","","","","Application Data"
"262","0.492151","7443","24231","TLSv1.3","16450","","","","","Application Data"
"263","0.492160","7443","24231","TLSv1.3","16450","","","","","Application Data"
"264","0.492175","7443","24231","TLSv1.3","16450","","","","","Application Data"
"265","0.492193","7443","24231","TLSv1.3","16450","","","","","Application Data"
"266","0.492210","7443","24231","TLSv1.3","16450","","","","","Application Data"
"267","0.492224","24231","7443","TCP","44","","","","","24231  >  7443 [ACK] Seq=909 Ack=2331960 Win=2463744 Len=0"
"268","0.492337","7443","24231","TLSv1.3","16450","","","","","Application Data"
"269","0.492353","7443","24231","TLSv1.3","16450","","","","","Application Data"
"270","0.492371","24231","7443","TCP","44","","","","","[TCP Window Update] 24231  >  7443 [ACK] Seq=909 Ack=2331960 Win=2529536 Len=0"
"271","0.492377","7443","24231","TLSv1.3","16450","","","","","Application Data"
"272","0.492395","7443","24231","TLSv1.3","16450","","","","","Application Data"
"273","0.492415","7443","24231","TLSv1.3","16450","","","","","Application Data"
"274","0.492432","24231","7443","TCP","44","","","","","[TCP Window Update] 24231  >  7443 [ACK] Seq=909 Ack=2331960 Win=2595072 Len=0"
"275","0.492437","7443","24231","TLSv1.3","16450","","","","","Application Data"
"276","0.492454","7443","24231","TLSv1.3","16450","","","","","Application Data"
"277","0.492472","7443","24231","TLSv1.3","16450","","","","","Application Data"
"278","0.492489","7443","24231","TLSv1.3","16450","","","","","Application Data"
"279","0.492508","7443","24231","TLSv1.3","16450","","","","","Application Data"
"280","0.492527","7443","24231","TLSv1.3","16450","","","","","Application Data"
"281","0.492545","24231","7443","TCP","44","","","","","24231  >  7443 [ACK] Seq=909 Ack=2463208 Win=2463744 Len=0"
"282","0.492694","7443","24231","TLSv1.3","16450","","","","","Application Data"
"283","0.492713","24231","7443","TCP","44","","","","","[TCP Window Update] 24231  >  7443 [ACK] Seq=909 Ack=2463208 Win=2529280 Len=0"
"284","0.492719","7443","24231","TLSv1.3","16450","","","","","Application Data"
"285","0.492739","7443","24231","TLSv1.3","16450","","","","","Application Data"
"286","0.492757","24231","7443","TCP","44","","","","","[TCP Window Update] 24231  >  7443 [ACK] Seq=909 Ack=2463208 Win=2594816 Len=0"
"287","0.492763","7443","24231","TLSv1.3","16450","","","","","Application Data"
"288","0.492782","7443","24231","TLSv1.3","16450","","","","","Application Data"
"289","0.492800","7443","24231","TLSv1.3","16450","","","","","Application Data"
"290","0.492820","7443","24231","TLSv1.3","16450","","","","","Application Data"
"291","0.492843","7443","24231","TLSv1.3","16450","","","","","Application Data"
"292","0.492862","7443","24231","TLSv1.3","16450","","","","","Application Data"
"293","0.492879","7443","24231","TLSv1.3","16450","","","","","Application Data"
"294","0.492895","7443","24231","TLSv1.3","16450","","","","","Application Data"
"295","0.492910","7443","24231","TLSv1.3","16450","","","","","Application Data"
"296","0.492928","7443","24231","TLSv1.3","16450","","","","","Application Data"
"297","0.492944","7443","24231","TLSv1.3","16450","","","","","Application Data"
"298","0.492957","7443","24231","TLSv1.3","16450","","","","","Application Data"
"299","0.492971","24231","7443","TCP","44","","","","","24231  >  7443 [ACK] Seq=909 Ack=2643674 Win=2492416 Len=0"
"300","0.493321","7443","24231","TLSv1.3","16450","","","","","Application Data"
"301","0.493343","7443","24231","TLSv1.3","16450","","","","","Application Data"
"302","0.493363","7443","24231","TLSv1.3","16450","","","","","Application Data"
"303","0.493386","24231","7443","TCP","44","","","","","[TCP Window Update] 24231  >  7443 [ACK] Seq=909 Ack=2643674 Win=2557952 Len=0"
"304","0.493394","7443","24231","TLSv1.3","16450","","","","","Application Data"
"305","0.493410","7443","24231","TLSv1.3","16450","","","","","Application Data"
"306","0.493429","7443","24231","TLSv1.3","16450","","","","","Application Data"
"307","0.493449","7443","24231","TLSv1.3","16450","","","","","Application Data"
"308","0.493470","7443","24231","TLSv1.3","16450","","","","","Application Data"
"309","0.493506","7443","24231","TLSv1.3","16450","","","","","Application Data"
"310","0.493528","7443","24231","TLSv1.3","16450","","","","","Application Data"
"311","0.493551","7443","24231","TLSv1.3","16450","","","","","Application Data"
"312","0.493573","7443","24231","TLSv1.3","16450","","","","","Application Data"
"313","0.493600","7443","24231","TLSv1.3","16450","","","","","Application Data"
"314","0.493625","7443","24231","TLSv1.3","16450","","","","","Application Data"
"315","0.493645","7443","24231","TLSv1.3","16450","","","","","Application Data"
"316","0.493696","7443","24231","TLSv1.3","16450","","","","","Application Data"
"317","0.493708","24231","7443","TCP","44","","","","","24231  >  7443 [ACK] Seq=909 Ack=2889764 Win=2311936 Len=0"
"318","0.493996","24231","7443","TCP","44","","","","","24231  >  7443 [ACK] Seq=909 Ack=3152260 Win=2049280 Len=0"
"319","0.498630","24231","7443","TCP","44","","","","","[TCP Window Update] 24231  >  7443 [ACK] Seq=909 Ack=3152260 Win=2118400 Len=0"
"320","0.507474","24231","7443","TCP","44","","","","","[TCP Window Update] 24231  >  7443 [ACK] Seq=909 Ack=3152260 Win=2184192 Len=0"
"321","0.511300","24231","7443","TCP","44","","","","","[TCP Window Update] 24231  >  7443 [ACK] Seq=909 Ack=3152260 Win=2249728 Len=0"
"322","0.515296","24231","7443","TCP","44","","","","","[TCP Window Update] 24231  >  7443 [ACK] Seq=909 Ack=3152260 Win=2315520 Len=0"
"323","0.518696","24231","7443","TCP","44","","","","","[TCP Window Update] 24231  >  7443 [ACK] Seq=909 Ack=3152260 Win=2381056 Len=0"
"324","0.527992","24231","7443","TCP","44","","","","","[TCP Window Update] 24231  >  7443 [ACK] Seq=909 Ack=3152260 Win=2446592 Len=0"
"325","0.531956","24231","7443","TCP","44","","","","","[TCP Window Update] 24231  >  7443 [ACK] Seq=909 Ack=3152260 Win=2512384 Len=0"
"326","0.535551","24231","7443","TCP","44","","","","","[TCP Window Update] 24231  >  7443 [ACK] Seq=909 Ack=3152260 Win=2577920 Len=0"
"327","0.580250","24231","7443","TLSv1.3","68","","","","","Application Data"
"328","0.580276","7443","24231","TCP","44","","","","","7443  >  24231 [ACK] Seq=3152260 Ack=933 Win=2619136 Len=0"
"329","0.580357","24231","7443","TCP","44","","","","","24231  >  7443 [FIN, ACK] Seq=933 Ack=3152260 Win=2577920 Len=0"
"330","0.580370","7443","24231","TCP","44","","","","","7443  >  24231 [ACK] Seq=3152260 Ack=934 Win=2619136 Len=0"
"331","0.580398","7443","24231","TLSv1.3","68","","","","","Application Data"
"332","0.580417","24231","7443","TCP","44","","","","","24231  >  7443 [ACK] Seq=934 Ack=3152284 Win=2577920 Len=0"
"333","0.580440","24231","7443","TCP","44","","","","","24231  >  7443 [RST, ACK] Seq=934 Ack=3152284 Win=0 Len=0"
"334","0.580465","7443","24231","TCP","44","","","","","7443  >  24231 [FIN, ACK] Seq=3152284 Ack=934 Win=2619136 Len=0"
"335","0.580477","24231","7443","TCP","44","","","","","24231  >  7443 [RST] Seq=934 Win=0 Len=0"
